,PO / SO #,Country,Managed By,Fulfill Via,Vendor INCO Term,Shipment Mode,PQ First Sent to Client Date,PO Sent to Vendor Date,Scheduled Delivery Date,Delivered to Client Date,Delivery Recorded Date,Product Group,Sub Classification,Vendor,Item Description,Molecule/Test Type,Brand,Dosage,Dosage Form,Unit of Measure (Per Pack),Line Item Quantity,Line Item Value,Pack Price,Unit Price,Manufacturing Site,First Line Designation,Weight (Kilograms),Freight Cost (USD),Line Item Insurance (USD),Days to Deliver
2682,SCMS-188650,Vietnam,PMO - US,Direct Drop,EXW,Air,2013-05-03,5/15/2013,2014-01-09,2014-01-09,2014-01-09,ARV,Adult,MYLAN LABORATORIES LTD (FORMERLY MATRIX LABORATORIES),"Lamivudine/Zidovudine 150/300mg, tablets, 60 Tabs",Lamivudine/Zidovudine,Generic,150/300mg,Tablet - FDC,60,11092,74871.0,6.75,0.11,Mylan (formerly Matrix) Nashik,Yes,957.0,1869.41,92.62,251 days 00:00:00.000000000
2684,SCMS-138620,Haiti,PMO - US,Direct Drop,EXW,Air,2012-01-06,2/24/2012,2012-06-12,2012-06-12,2012-06-12,ARV,Pediatric,CIPLA LIMITED,"Lamivudine/Nevirapine/Stavudine 30/50/6mg, dispersible tablets, 60 Tabs",Lamivudine/Nevirapine/Stavudine,Generic,30/50/6mg,Chewable/dispersible tablet - FDC,60,298,685.4,2.3,0.04,"Cipla, Goa, India",Yes,21.0,304.62,0.96,158 days 00:00:00.000000000
2686,SCMS-263040,Mozambique,PMO - US,Direct Drop,FCA,Air,2014-10-28,11/7/2014,2015-04-15,2015-04-15,2015-04-15,ARV,Adult,ABBVIE LOGISTICS (FORMERLY ABBOTT LOGISTICS BV),"Ritonavir 100mg [Norvir], film coated tablets, 60 Tabs",Ritonavir,Norvir,100mg,Tablet,60,400,2740.0,6.85,0.11,ABBVIE Ludwigshafen Germany,Yes,62.0,642.99,3.22,169 days 00:00:00.000000000
2690,SCMS-226220,Vietnam,PMO - US,Direct Drop,EXW,Air,2014-02-06,3/10/2014,2014-07-29,2014-07-29,2014-08-06,ARV,Adult,HETERO LABS LIMITED,"Efavirenz 600mg, tablets, 30 Tabs",Efavirenz,Generic,600mg,Tablet,30,5300,18550.0,3.5,0.12,Hetero Unit III Hyderabad IN,Yes,2922.0,5616.02,19.07,173 days 00:00:00.000000000
2691,SCMS-103410,South Africa,PMO - US,Direct Drop,DDP,Ocean,2011-03-10,3/24/2011,2011-09-14,2011-10-27,2011-10-27,ARV,Pediatric,Aurobindo Pharma Limited,"Efavirenz 50mg, capsule, 30 Caps",Efavirenz,Generic,50mg,Capsule,30,54768,133633.92,2.44,0.08,"Aurobindo Unit III, India",Yes,3237.0,10923.46,220.5,231 days 00:00:00.000000000
2692,SCMS-259075,South Africa,PMO - US,Direct Drop,DDP,Truck,2014-09-11,5/11/2015,2015-05-12,2015-05-12,2015-05-12,ARV,Adult,PHARMACY DIRECT,"Abacavir 300mg, tablets, 60 Tabs",Abacavir,Generic,300mg,Tablet,60,25,1246.3,49.85,0.83,"Aurobindo Unit III, India",Yes,4306.83476898982,11462.107118413907,1.28,243 days 00:00:00.000000000
2693,SCMS-238550,South Africa,PMO - US,Direct Drop,DDP,Truck,2014-04-30,5/8/2014,2015-02-19,2015-02-19,2015-02-19,ARV,Adult,PHARMACY DIRECT,"Abacavir 300mg, tablets, 60 Tabs",Abacavir,Generic,300mg,Tablet,60,3,206.97,68.99,1.15,"Aurobindo Unit III, India",Yes,4306.83476898982,11462.107118413907,0.21,295 days 00:00:00.000000000
2694,SCMS-188540,Vietnam,PMO - US,Direct Drop,EXW,Air,2013-05-03,5/10/2013,2013-10-11,2013-10-09,2013-10-09,ARV,Adult,MYLAN LABORATORIES LTD (FORMERLY MATRIX LABORATORIES),"Efavirenz/Lamivudine/Tenofovir Disoproxil Fumarate 600/300/300mg, tablets, 30 Tabs",Efavirenz/Lamivudine/Tenofovir Disoproxil Fumarate,Generic,600/300/300mg,Tablet - FDC,30,11500,132135.0,11.49,0.38,Mylan (formerly Matrix) Nashik,Yes,1295.0,2021.05,163.45,159 days 00:00:00.000000000
2695,SCMS-236120,Vietnam,PMO - US,Direct Drop,EXW,Air,2014-04-08,4/30/2014,2014-09-16,2014-09-16,2014-10-01,ARV,Adult,HETERO LABS LIMITED,"Tenofovir Disoproxil Fumarate 300mg, tablets, 30 Tabs",Tenofovir Disoproxil Fumarate,Generic,300mg,Tablet,30,16000,56800.0,3.55,0.12,Hetero Unit III Hyderabad IN,Yes,1948.0,3138.25,58.39,161 days 00:00:00.000000000
2696,SCMS-199283,South Africa,PMO - US,Direct Drop,DDP,Truck,2013-07-11,8/27/2014,2014-08-27,2014-08-27,2014-08-27,ARV,Adult,S. BUYS WHOLESALER,"Emtricitabine/Tenofovir Disoproxil Fumarate 200/300mg, tablets, 30 Tabs",Emtricitabine/Tenofovir Disoproxil Fumarate,Generic,200/300mg,Tablet - FDC,30,13,438.41,33.72,1.12,"Aurobindo Unit III, India",Yes,4306.83476898982,11462.107118413907,0.54,412 days 00:00:00.000000000
2698,SCMS-244720,Dominican Republic,PMO - US,Direct Drop,DDP,Air,2014-06-13,6/23/2014,2014-01-14,2014-01-14,2014-02-07,ARV,Pediatric,"ABBVIE, SRL (FORMALLY ABBOTT LABORATORIES INTERNATIONAL CO.)","Lopinavir/Ritonavir 80/20mg/ml [Kaletra], oral solution, cool, Bottle, 160 ml",Lopinavir/Ritonavir,Kaletra,80/20mg/ml,Oral solution,160,4570,148250.8,32.44,0.2,ABBVIE Labs North Chicago US,Yes,4306.83476898982,11462.107118413907,152.4,-150 days +00:00:00.000000000
2700,SCMS-68910,South Africa,PMO - US,Direct Drop,DDP,Air,2010-03-18,3/19/2010,2010-08-24,2010-08-24,2010-08-24,ARV,Adult,Aurobindo Pharma Limited,"Efavirenz 600mg, tablets, 30 Tabs",Efavirenz,Generic,600mg,Tablet,30,56877,265615.59,4.67,0.16,"Aurobindo Unit III, India",Yes,4815.0,5886.9,572.67,159 days 00:00:00.000000000
2702,SCMS-199283,South Africa,PMO - US,Direct Drop,DDP,Truck,2013-07-11,8/27/2014,2014-08-27,2014-08-27,2014-08-27,ARV,Adult,S. BUYS WHOLESALER,"Zidovudine 300mg, tablets, 60 Tabs",Zidovudine,Generic,300mg,Tablet,60,14,389.56,27.83,0.46,"Aurobindo Unit III, India",Yes,4306.83476898982,11462.107118413907,0.48,412 days 00:00:00.000000000
2703,SCMS-274370,Vietnam,PMO - US,Direct Drop,EXW,Air,2015-01-28,2/17/2015,2015-07-13,2015-07-13,2015-07-14,ARV,Adult,HETERO LABS LIMITED,"Efavirenz/Lamivudine/Tenofovir Disoproxil Fumarate 600/300/300mg, tablets, 30 Tabs",Efavirenz/Lamivudine/Tenofovir Disoproxil Fumarate,Generic,600/300/300mg,Tablet - FDC,30,17760,177600.0,10.0,0.33,Hetero Unit III Hyderabad IN,Yes,2516.0,3816.3,209.04,166 days 00:00:00.000000000
2704,SCMS-51780,Vietnam,PMO - US,Direct Drop,EXW,Air,2009-08-12,8/14/2009,2009-10-26,2009-10-26,2009-10-26,ARV,Adult,MYLAN LABORATORIES LTD (FORMERLY MATRIX LABORATORIES),"Tenofovir Disoproxil Fumarate 300mg, tablets, 30 Tabs",Tenofovir Disoproxil Fumarate,Generic,300mg,Tablet,30,1680,13860.0,8.25,0.28,Mylan (formerly Matrix) Nashik,Yes,110.0,791.43,27.17,75 days 00:00:00.000000000
2705,SCMS-84420,Rwanda,PMO - US,Direct Drop,CIP,Air,2010-09-03,9/29/2010,2010-11-02,2010-11-02,2010-11-02,ARV,Adult,MYLAN LABORATORIES LTD (FORMERLY MATRIX LABORATORIES),"Lamivudine/Tenofovir Disoproxil Fumarate 300/300mg, tablets, 30 Tabs",Lamivudine/Tenofovir Disoproxil Fumarate,Generic,300/300mg,Tablet - FDC,30,138422,1211192.5,8.75,0.29,Mylan (formerly Matrix) Nashik,Yes,13147.0,4781.8,2611.33,60 days 00:00:00.000000000
2707,SCMS-163880,Malawi,PMO - US,Direct Drop,EXW,Ocean,2012-10-17,10/31/2012,2013-06-21,2013-06-21,2013-06-21,ARV,Adult,MYLAN LABORATORIES LTD (FORMERLY MATRIX LABORATORIES),"Efavirenz/Lamivudine/Tenofovir Disoproxil Fumarate 600/300/300mg, tablets, 30 Tabs",Efavirenz/Lamivudine/Tenofovir Disoproxil Fumarate,Generic,600/300/300mg,Tablet - FDC,30,243800,2801262.0,11.49,0.38,Mylan (formerly Matrix) Nashik,Yes,27549.0,24875.46,3465.16,247 days 00:00:00.000000000
2708,SCMS-53520,Mozambique,PMO - US,Direct Drop,CIP,Air,2009-09-02,9/24/2009,2010-03-19,2010-03-19,2010-03-19,ARV,Adult,INTERNATIONAL HEALTHCARE DISTRIBUTORS,"Ritonavir 100mg [Norvir], capsules, cool, 84 Caps",Ritonavir,Norvir,100mg,Capsule,84,520,5366.4,10.32,0.12,ABBVIE (Abbott) France,Yes,149.0,11462.107118413907,10.52,198 days 00:00:00.000000000
2709,SCMS-259072,South Africa,PMO - US,Direct Drop,DDP,Truck,2014-09-11,1/26/2015,2015-01-26,2015-01-26,2015-01-26,ARV,Adult,PHARMACY DIRECT,"Tenofovir Disoproxil Fumarate 300mg, tablets, 30 Tabs",Tenofovir Disoproxil Fumarate,Generic,300mg,Tablet,30,132,1823.8,13.82,0.46,Mylan (formerly Matrix) Nashik,Yes,4306.83476898982,11462.107118413907,1.87,137 days 00:00:00.000000000
2710,SCMS-261510,Haiti,PMO - US,Direct Drop,EXW,Ocean,2014-09-24,11/14/2014,2015-03-13,2015-03-13,2015-03-18,ARV,Adult,MYLAN LABORATORIES LTD (FORMERLY MATRIX LABORATORIES),"Efavirenz/Lamivudine/Tenofovir Disoproxil Fumarate 600/300/300mg, tablets, 30 Tabs",Efavirenz/Lamivudine/Tenofovir Disoproxil Fumarate,Generic,600/300/300mg,Tablet - FDC,30,25000,256000.0,10.24,0.34,Mylan (formerly Matrix) Nashik,Yes,3034.0,7658.27,263.17,170 days 00:00:00.000000000
2711,SCMS-246550,Côte d'Ivoire,PMO - US,Direct Drop,FCA,Air,2014-06-03,7/31/2014,2014-11-03,2014-11-03,2014-11-07,ARV,Pediatric,ABBVIE LOGISTICS (FORMERLY ABBOTT LOGISTICS BV),"Lopinavir/Ritonavir 80/20mg/ml [Kaletra], oral solution, cool, Bottle 5 x 60 ml",Lopinavir/Ritonavir,Kaletra,80/20mg/ml,Oral solution,300,500,15410.0,30.82,0.1,ABBVIE (Abbott) Logis. UK,Yes,505.0,6523.85,15.84,153 days 00:00:00.000000000
2713,SCMS-249040,Vietnam,PMO - US,Direct Drop,EXW,Air,2014-07-09,8/8/2014,2015-02-05,2015-02-05,2015-02-05,ARV,Adult,MYLAN LABORATORIES LTD (FORMERLY MATRIX LABORATORIES),"Lamivudine/Nevirapine/Zidovudine 150/200/300mg, tablets, 60 Tabs",Lamivudine/Nevirapine/Zidovudine,Generic,150/300/200mg,Tablet - FDC,60,13000,105300.0,8.1,0.13,Mylan (formerly Matrix) Nashik,Yes,2672.0,2504.64,108.25,211 days 00:00:00.000000000
2714,SCMS-259074,South Africa,PMO - US,Direct Drop,DDP,Truck,2014-09-11,3/9/2015,2015-03-09,2015-03-09,2015-03-09,ARV,Adult,PHARMACY DIRECT,"Efavirenz 600mg, tablets, 30 Tabs",Efavirenz,Generic,600mg,Tablet,30,139,1566.38,11.27,0.38,"Aurobindo Unit III, India",Yes,4306.83476898982,11462.107118413907,1.61,179 days 00:00:00.000000000
2717,SCMS-143480,Uganda,PMO - US,Direct Drop,DDP,Air,2012-03-15,4/17/2012,2012-05-21,2012-05-21,2012-05-21,ARV,Adult,ASPEN PHARMACARE,"Etravirine 100mg [Intelence], tablets, 120 Tabs",Etravirine,Intelence,100mg,Tablet,120,121,9075.0,75.0,0.62,"Janssen-Cilag, Latina, IT",Yes,43.0,199.0,12.72,67 days 00:00:00.000000000
2719,SCMS-48290,Vietnam,PMO - US,Direct Drop,EXW,Air,2009-06-25,6/29/2009,2009-09-30,2009-09-30,2009-09-30,ARV,Adult,MYLAN LABORATORIES LTD (FORMERLY MATRIX LABORATORIES),"Efavirenz 600mg, tablets, 30 Tabs",Efavirenz,Generic,600mg,Tablet,30,21504,139776.0,6.5,0.22,Mylan (formerly Matrix) Nashik,Yes,1849.0,4191.83,273.96,97 days 00:00:00.000000000
2721,SCMS-219220,Mozambique,PMO - US,Direct Drop,EXW,Air,2013-12-11,12/17/2013,2014-05-02,2014-05-02,2014-05-07,ARV,Adult,HETERO LABS LIMITED,"Lamivudine/Nevirapine/Zidovudine 150/200/300mg, tablets, 60 Tabs",Lamivudine/Nevirapine/Zidovudine,Generic,150/300/200mg,Tablet - FDC,60,35136,284952.96,8.11,0.14,Hetero Unit III Hyderabad IN,Yes,4784.0,19286.53,292.93,142 days 00:00:00.000000000
2723,SCMS-180940,Haiti,PMO - US,Direct Drop,EXW,Ocean,2013-02-07,3/22/2013,2013-09-02,2013-09-02,2013-09-02,ARV,Pediatric,Aurobindo Pharma Limited,"Zidovudine 10mg/ml, oral solution w/syringe, Bottle, 240 ml",Zidovudine,Generic,10mg/ml,Oral solution,240,1832,3847.2,2.1,0.01,"Aurobindo Unit III, India",Yes,3504.0,7117.39,4.76,207 days 00:00:00.000000000
2725,SCMS-145320,Vietnam,PMO - US,Direct Drop,FCA,Air,2012-04-11,6/15/2012,2012-10-03,2012-10-03,2012-10-03,ARV,Adult,ABBVIE LOGISTICS (FORMERLY ABBOTT LOGISTICS BV),"Ritonavir 100mg [Norvir], film coated tablets, 30 Tabs",Ritonavir,Norvir,100mg,Tablet,30,174,4047.24,23.26,0.78,ABBVIE Ludwigshafen Germany,Yes,21.0,583.66,5.67,175 days 00:00:00.000000000
2726,SCMS-249050,Vietnam,PMO - US,Direct Drop,EXW,Air,2014-07-09,8/11/2014,2014-12-17,2014-12-17,2014-12-17,ARV,Adult,HETERO LABS LIMITED,"Tenofovir Disoproxil Fumarate 300mg, tablets, 30 Tabs",Tenofovir Disoproxil Fumarate,Generic,300mg,Tablet,30,4000,14200.0,3.55,0.12,Hetero Unit III Hyderabad IN,Yes,4306.83476898982,11462.107118413907,14.6,161 days 00:00:00.000000000
2727,SCMS-254170,Nigeria,PMO - US,Direct Drop,EXW,Air,2014-08-13,8/29/2014,2015-08-05,2015-08-05,2015-08-10,ARV,Adult,EMCURE PHARMACEUTICALS LTD,"Atazanavir/Ritonavir 300/100mg, tablets, 30 Tabs",Atazanavir/Ritonavir,Generic,300/100mg,Tablet,30,4560,82080.0,18.0,0.6,"Emcure Plot No.P-2, I.T-B.T. Park, Phase II, MIDC, Hinjwadi, Pune, India",Yes,4306.83476898982,11462.107118413907,84.38,357 days 00:00:00.000000000
2728,SCMS-234720,Zimbabwe,PMO - US,Direct Drop,EXW,Air,2014-04-01,5/8/2014,2014-06-14,2014-06-14,2014-06-16,ARV,Adult,Aurobindo Pharma Limited,"Lamivudine/Tenofovir Disoproxil Fumarate 300/300mg, tablets, 30 Tabs",Lamivudine/Tenofovir Disoproxil Fumarate,Generic,300/300mg,Tablet - FDC,30,32670,151915.5,4.65,0.16,"Aurobindo Unit VII, IN",Yes,3076.0,25730.13,156.17,74 days 00:00:00.000000000
2729,SCMS-50290,Rwanda,PMO - US,Direct Drop,CIP,Air,2009-07-16,8/31/2009,2010-04-16,2010-04-16,2010-04-16,ARV,Adult,MYLAN LABORATORIES LTD (FORMERLY MATRIX LABORATORIES),"Lamivudine/Tenofovir Disoproxil Fumarate 300/300mg, tablets, 30 Tabs",Lamivudine/Tenofovir Disoproxil Fumarate,Generic,300/300mg,Tablet - FDC,30,62209,681188.55,10.95,0.36,Mylan (formerly Matrix) Nashik,Yes,5795.0,63600.4,1335.13,274 days 00:00:00.000000000
2730,SCMS-239810,"Congo, DRC",PMO - US,Direct Drop,EXW,Air,2014-05-15,5/19/2014,2014-09-30,2014-09-30,2014-10-21,ARV,Pediatric,Aurobindo Pharma Limited,"Nevirapine 50mg, dispersible tablets (tablets for oral suspension), 30 Tabs",Nevirapine,Generic,50mg,Chewable/dispersible tablet,30,940,1175.0,1.25,0.04,"Aurobindo Unit III, India",Yes,132.0,2516.57,1.21,138 days 00:00:00.000000000
2731,SCMS-259078,South Africa,PMO - US,Direct Drop,DDP,Truck,2014-09-11,10/9/2014,2015-07-24,2015-07-24,2015-07-24,ARV,Adult,PHARMACY DIRECT,"Darunavir 600mg [Prezista], tablets, 60 Tabs",Darunavir,Prezista,600mg,Tablet,60,33,1671.87,50.66,0.84,"Janssen-Cilag, Latina, IT",Yes,4306.83476898982,11462.107118413907,1.72,316 days 00:00:00.000000000
2733,SCMS-180960,Haiti,PMO - US,Direct Drop,EXW,Air,2013-02-07,3/22/2013,2013-08-14,2013-08-14,2013-08-14,ARV,Adult,MICRO LABS LIMITED,"Efavirenz 600mg, tablets, 30 Tabs",Efavirenz,Generic,600mg,Tablet,30,14448,46667.04,3.23,0.11,"Micro labs, Verna, Goa, India",Yes,2284.0,13257.25,57.73,188 days 00:00:00.000000000
2734,SCMS-192080,Uganda,PMO - US,Direct Drop,CIP,Air,2013-05-17,7/3/2013,2013-11-20,2013-11-20,2013-11-21,ARV,Adult,ASPEN PHARMACARE,"Etravirine 100mg [Intelence], tablets, 120 Tabs",Etravirine,Intelence,100mg,Tablet,120,108,3888.0,36.0,0.3,"Janssen-Cilag, Latina, IT",Yes,22.0,265.0,4.81,187 days 00:00:00.000000000
2736,SCMS-259071,South Africa,PMO - US,Direct Drop,DDP,Truck,2014-09-11,11/28/2014,2014-11-28,2014-11-28,2014-11-28,ARV,Pediatric,PHARMACY DIRECT,"Efavirenz 200mg, capsule, 90 Caps",Efavirenz,Generic,200mg,Capsule,90,16,272.7,17.04,0.19,"Aurobindo Unit III, India",Yes,4306.83476898982,11462.107118413907,0.28,78 days 00:00:00.000000000
2738,SCMS-200851,Tanzania,PMO - US,Direct Drop,EXW,Air,2013-07-15,10/8/2013,2014-03-22,2014-03-22,2014-03-22,ARV,Pediatric,Aurobindo Pharma Limited,"Efavirenz 50mg, capsule, 30 Caps",Efavirenz,Generic,50mg,Capsule,30,5925,9243.0,1.56,0.05,"Aurobindo Unit III, India",Yes,394.0,3245.39,11.43,250 days 00:00:00.000000000
2739,SCMS-236050,Vietnam,PMO - US,Direct Drop,EXW,Air,2014-04-08,4/30/2014,2014-10-30,2014-10-30,2014-11-04,ARV,Adult,MYLAN LABORATORIES LTD (FORMERLY MATRIX LABORATORIES),"Lamivudine/Zidovudine 150/300mg, tablets, 60 Tabs",Lamivudine/Zidovudine,Generic,150/300mg,Tablet - FDC,60,9800,63602.0,6.49,0.11,Mylan (formerly Matrix) Nashik,Yes,2235.0,3708.72,65.38,205 days 00:00:00.000000000
2741,SCMS-68750,South Africa,PMO - US,Direct Drop,DDP,Air,2010-03-18,3/19/2010,2010-10-13,2011-01-25,2011-01-25,ARV,Adult,CIPLA LIMITED,"Tenofovir Disoproxil Fumarate 300mg, tablets, 30 Tabs",Tenofovir Disoproxil Fumarate,Generic,300mg,Tablet,30,19992,156337.44,7.82,0.26,"Cipla, Goa, India",Yes,1378.0,3646.1,337.06,313 days 00:00:00.000000000
2742,SCMS-242720,Zambia,PMO - US,Direct Drop,EXW,Air,2014-05-21,6/4/2014,2014-12-01,2014-12-01,2014-12-10,ARV,Pediatric,MYLAN LABORATORIES LTD (FORMERLY MATRIX LABORATORIES),"Lamivudine/Zidovudine 30/60mg, dispersible tablets, 60 Tabs",Lamivudine/Zidovudine,Generic,30/60mg,Chewable/dispersible tablet - FDC,60,10000,19900.0,1.99,0.03,"Mylan,  H-12 & H-13, India",Yes,849.0,4316.34,20.46,194 days 00:00:00.000000000
2744,SCMS-176300,Vietnam,PMO - US,Direct Drop,EXW,Air,2013-01-29,2/6/2013,2013-07-01,2013-07-01,2013-07-01,ARV,Adult,HETERO LABS LIMITED,"Lamivudine/Zidovudine 150/300mg, tablets, 60 Tabs",Lamivudine/Zidovudine,Generic,150/300mg,Tablet - FDC,60,9095,62300.75,6.85,0.11,Hetero Unit III Hyderabad IN,Yes,1736.0,8163.83,77.07,153 days 00:00:00.000000000
2746,SCMS-236070,Vietnam,PMO - US,Direct Drop,EXW,Air,2014-04-08,4/30/2014,2014-11-07,2014-11-07,2014-11-08,ARV,Adult,MICRO LABS LIMITED,"Nevirapine 200mg, tablets, 60 Tabs",Nevirapine,Generic,200mg,Tablet,60,7600,15808.0,2.08,0.03,"Micro labs, Verna, Goa, India",Yes,1292.0,2800.95,16.25,213 days 00:00:00.000000000
2747,SCMS-261060,Haiti,PMO - US,Direct Drop,EXW,Air,2014-09-24,11/14/2014,2015-02-12,2015-02-12,2015-02-13,ARV,Adult,HETERO LABS LIMITED,"Lamivudine/Zidovudine 150/300mg, tablets, 60 Tabs",Lamivudine/Zidovudine,Generic,150/300mg,Tablet - FDC,60,50544,334095.84,6.61,0.11,"Hetero, Jadcherla, unit 5, IN",Yes,4669.0,34778.32,343.45,141 days 00:00:00.000000000
2748,SCMS-54980,South Africa,PMO - US,Direct Drop,DDP,Truck,2009-10-08,10/15/2009,2009-10-19,2009-10-19,2009-10-19,ARV,Pediatric,S. BUYS WHOLESALER,"Efavirenz 200mg, capsule, 90 Caps",Efavirenz,Generic,200mg,Capsule,90,100,3297.8,32.98,0.37,"Aurobindo Unit III, India",Yes,4306.83476898982,11462.107118413907,6.46,11 days 00:00:00.000000000
2749,SCMS-64580,Vietnam,PMO - US,Direct Drop,EXW,Air,2010-02-02,2/3/2010,2010-03-30,2010-03-30,2010-03-30,ARV,Adult,Aurobindo Pharma Limited,"Tenofovir Disoproxil Fumarate 300mg, tablets, 30 Tabs",Tenofovir Disoproxil Fumarate,Generic,300mg,Tablet,30,3528,27342.0,7.75,0.26,"Aurobindo Unit III, India",Yes,395.0,3538.57,58.95,56 days 00:00:00.000000000
2754,SCMS-109830,Benin,PMO - US,Direct Drop,EXW,Air,2011-05-16,5/27/2011,2011-07-12,2011-07-12,2011-07-12,ARV,Adult,MYLAN LABORATORIES LTD (FORMERLY MATRIX LABORATORIES),"Efavirenz/Lamivudine/Tenofovir Disoproxil Fumarate 600/300/300mg, tablets, 30 Tabs",Efavirenz/Lamivudine/Tenofovir Disoproxil Fumarate,Generic,600/300/300mg,Tablet - FDC,30,1244,17540.4,14.1,0.47,Mylan (formerly Matrix) Nashik,Yes,175.0,5864.56,28.94,57 days 00:00:00.000000000
2755,SCMS-215410,South Africa,PMO - US,Direct Drop,DDP,Truck,2013-11-14,12/2/2013,2014-01-13,2014-01-13,2014-01-13,ARV,Adult,S. BUYS WHOLESALER,"Lamivudine/Zidovudine 150/300mg, tablets, 60 Tabs",Lamivudine/Zidovudine,Generic,150/300mg,Tablet - FDC,60,59,1653.14,28.02,0.47,"Cipla, Goa, India",Yes,4306.83476898982,11462.107118413907,1.7,60 days 00:00:00.000000000
2756,SCMS-123870,Côte d'Ivoire,PMO - US,Direct Drop,EXW,Air,2011-08-29,9/30/2011,2011-12-01,2011-12-01,2011-12-01,ARV,Adult,MYLAN LABORATORIES LTD (FORMERLY MATRIX LABORATORIES),"Abacavir/Lamivudine/Zidovudine 300/150/300mg, tablets, 60 Tabs",Abacavir/Lamivudine/Zidovudine,Generic,300/150/300mg,Tablet - FDC,60,4000,112000.0,28.0,0.47,Mylan (formerly Matrix) Nashik,Yes,655.0,5300.24,184.8,94 days 00:00:00.000000000
2757,SCMS-176980,Rwanda,PMO - US,Direct Drop,FCA,Air,2013-02-03,2/6/2013,2013-05-17,2013-05-17,2013-05-17,ARV,Pediatric,ABBVIE LOGISTICS (FORMERLY ABBOTT LOGISTICS BV),"Lopinavir/Ritonavir 80/20mg/ml [Kaletra], oral solution, cool, Bottle 5 x 60 ml",Lopinavir/Ritonavir,Kaletra,80/20mg/ml,Oral solution,300,400,12328.0,30.82,0.1,ABBVIE (Abbott) Logis. UK,Yes,454.0,7152.99,15.25,103 days 00:00:00.000000000
2759,SCMS-215600,Mozambique,PMO - US,Direct Drop,EXW,Air,2013-11-12,11/26/2013,2014-04-09,2014-04-09,2014-07-08,ARV,Adult,Aurobindo Pharma Limited,"Didanosine 250mg, delayed-release capsules, 30 Caps",Didanosine,Generic,250mg,Delayed-release capsules,30,800,6064.0,7.58,0.25,"Aurobindo Unit III, India",Yes,77.0,979.14,6.23,148 days 00:00:00.000000000
2760,SCMS-212350,Uganda,PMO - US,Direct Drop,EXW,Air,2013-10-23,10/30/2013,2014-03-21,2014-03-21,2014-03-21,ARV,Pediatric,CIPLA LIMITED,"Lamivudine/Zidovudine 30/60mg, dispersible tablets, 60 Tabs",Lamivudine/Zidovudine,Generic,30/60mg,Chewable/dispersible tablet - FDC,60,7445,16676.8,2.24,0.04,"Cipla, Goa, India",Yes,574.0,3868.24,17.14,149 days 00:00:00.000000000
2761,SCMS-176190,Vietnam,PMO - US,Direct Drop,EXW,Air,2013-01-29,2/5/2013,2013-05-24,2013-05-24,2013-05-24,ARV,Pediatric,Aurobindo Pharma Limited,"Nevirapine 10mg/ml, oral suspension w/syringe, Bottle, 240 ml",Nevirapine,Generic,10mg/ml,Oral suspension,240,263,486.55,1.85,0.01,"Aurobindo Unit III, India",Yes,182.0,5970.85,0.6,115 days 00:00:00.000000000
2762,SCMS-62830,Ethiopia,PMO - US,Direct Drop,EXW,Air,2010-01-05,1/13/2010,2010-03-04,2010-03-04,2010-03-04,ARV,Adult,Aurobindo Pharma Limited,"Lamivudine 150mg, tablets, 60 Tabs",Lamivudine,Generic,150mg,Tablet,60,56000,133280.0,2.38,0.04,"Aurobindo Unit III, India",Yes,2996.0,10612.93,287.35,58 days 00:00:00.000000000
2763,SCMS-156530,Tanzania,PMO - US,Direct Drop,EXW,Air,2012-07-26,8/9/2012,2012-11-01,2012-11-01,2012-11-01,ARV,Adult,HETERO LABS LIMITED,"Efavirenz 600mg, tablets, 30 Tabs",Efavirenz,Generic,600mg,Tablet,30,100986,343352.4,3.4,0.11,Hetero Unit III Hyderabad IN,Yes,10579.0,41585.93,481.38,98 days 00:00:00.000000000
2766,SCMS-155700,Vietnam,PMO - US,Direct Drop,FCA,Air,2012-07-25,8/14/2012,2013-01-15,2013-01-15,2013-01-15,ARV,Adult,ABBVIE LOGISTICS (FORMERLY ABBOTT LOGISTICS BV),"Lopinavir/Ritonavir 200/50mg [Aluvia], tablets, 120 Tabs",Lopinavir/Ritonavir,Aluvia,200/50mg,Tablet,120,3812,231845.84,60.82,0.51,ABBVIE Ludwigshafen Germany,Yes,824.0,3216.15,325.05,174 days 00:00:00.000000000
2768,SCMS-48280,Vietnam,PMO - US,Direct Drop,EXW,Air,2009-06-25,6/29/2009,2009-09-28,2009-09-28,2009-09-28,ARV,Adult,MYLAN LABORATORIES LTD (FORMERLY MATRIX LABORATORIES),"Efavirenz 600mg, tablets, 30 Tabs",Efavirenz,Generic,600mg,Tablet,30,3528,22932.0,6.5,0.22,Mylan (formerly Matrix) Nashik,Yes,383.0,1162.52,44.95,95 days 00:00:00.000000000
2770,SCMS-238554,South Africa,PMO - US,Direct Drop,DDP,Truck,2014-04-30,10/3/2014,2014-10-03,2014-10-03,2014-10-03,ARV,Adult,PHARMACY DIRECT,"Abacavir 300mg, tablets, 60 Tabs",Abacavir,Generic,300mg,Tablet,60,9,620.91,68.99,1.15,"Aurobindo Unit III, India",Yes,4306.83476898982,11462.107118413907,0.64,156 days 00:00:00.000000000
2771,SCMS-210920,Tanzania,PMO - US,Direct Drop,EXW,Air,2013-10-03,10/28/2013,2014-03-22,2014-03-22,2014-03-22,ARV,Pediatric,Aurobindo Pharma Limited,"Efavirenz 50mg, capsule, 30 Caps",Efavirenz,Generic,50mg,Capsule,30,20867,32552.52,1.56,0.05,"Aurobindo Unit III, India",Yes,1337.0,8403.67,40.27,170 days 00:00:00.000000000
2772,SCMS-103970,South Africa,PMO - US,Direct Drop,DDP,Ocean,2011-03-10,3/28/2011,2011-09-02,2011-09-02,2011-09-02,ARV,Adult,STRIDES ARCOLAB LIMITED,"Nevirapine 200mg, tablets, 60 Tabs",Nevirapine,Generic,200mg,Tablet,60,150000,430500.0,2.87,0.05,"Strides, Bangalore, India.",Yes,9306.0,10511.33,710.32,176 days 00:00:00.000000000
2773,SCMS-84200,South Africa,PMO - US,Direct Drop,DDP,Ocean,2010-08-31,9/21/2010,2011-03-14,2011-03-14,2011-03-14,ARV,Adult,CIPLA LIMITED,"Nevirapine 200mg, tablets, 60 Tabs",Nevirapine,Generic,200mg,Tablet,60,159000,443610.0,2.79,0.05,"Cipla, Goa, India",Yes,16729.0,25199.31,956.42,195 days 00:00:00.000000000
2774,SCMS-93420,Nigeria,PMO - US,Direct Drop,EXW,Air,2010-07-29,12/7/2010,2011-02-28,2011-02-28,2011-02-28,ACT,ACT,NOVARTIS PHARMA SERVICES AG,"Artemether/Lumefantrine 20/120mg [Coartem], scored tablets, Blister 30 x 24 Tabs",Artemether/Lumefantrine,Coartem,20/120mg,Tablet - FDC + blister,720,1245,48555.0,39.0,0.05,"Novartis Pharma Suffern, USA",Yes,859.0,5810.56,104.68,214 days 00:00:00.000000000
2775,SCMS-238555,South Africa,PMO - US,Direct Drop,DDP,Truck,2014-04-30,11/4/2014,2014-11-05,2014-11-05,2014-11-05,ARV,Adult,PHARMACY DIRECT,"Raltegravir 400mg [Isentress], tablets, 60 Tabs",Raltegravir,Isentress,400mg,Tablet,60,24,2031.3,84.64,1.41,"MSD, Haarlem, NL",Yes,4306.83476898982,11462.107118413907,2.09,189 days 00:00:00.000000000
2776,SCMS-126230,Rwanda,PMO - US,Direct Drop,FCA,Air,2011-10-19,11/2/2011,2012-07-05,2012-07-05,2012-07-05,ARV,Adult,Hoffmann-La Roche ltd Basel,"Nelfinavir (as mesilate) 250mg [Viracept], tablets, 270 Tabs",Nelfinavir (as mesilate),Viracept,250mg,Tablet,270,109,17410.04,159.73,0.59,Roche Madrid,Yes,27.0,2205.25,28.73,260 days 00:00:00.000000000
2777,SCMS-60170,South Africa,PMO - US,Direct Drop,DDP,Truck,2009-12-17,12/23/2009,2009-12-29,2009-12-29,2009-12-29,ARV,Adult,S. BUYS WHOLESALER,"Emtricitabine/Tenofovir Disoproxil Fumarate 200/300mg [Truvada], tablets, 30 Tabs",Emtricitabine/Tenofovir Disoproxil Fumarate,Truvada,300/200mg,Tablet - FDC,30,100,4669.76,46.7,1.56,"Aspen-OSD, Port Elizabeth, SA",Yes,4306.83476898982,11462.107118413907,10.07,12 days 00:00:00.000000000
2778,SCMS-259085,South Africa,PMO - US,Direct Drop,DDP,Truck,2014-09-11,7/14/2015,2015-07-14,2015-07-14,2015-07-14,ARV,Pediatric,PHARMACY DIRECT,"Lopinavir/Ritonavir 80/20mg/ml [Kaletra], oral solution, cool, Bottle 5 x 60 ml",Lopinavir/Ritonavir,Kaletra,80/20mg/ml,Oral solution,300,3,51.42,17.14,0.06,ABBVIE (Abbott) Logis. UK,Yes,4306.83476898982,11462.107118413907,0.05,306 days 00:00:00.000000000
2779,SCMS-91340,South Africa,PMO - US,Direct Drop,DDP,Air,2010-08-31,11/19/2010,2011-02-09,2011-02-09,2011-02-09,ARV,Pediatric,ASPEN PHARMACARE,"Abacavir 20mg/ml [Ziagen], oral solution, Bottle, 240 ml",Abacavir,Ziagen,20mg/ml,Oral solution,240,28000,280560.0,10.02,0.04,GSK Mississauga (Canada),Yes,4306.83476898982,11462.107118413907,604.89,162 days 00:00:00.000000000
2780,SCMS-104380,South Africa,PMO - US,Direct Drop,DDP,Ocean,2011-03-10,4/1/2011,2011-11-03,2011-10-10,2011-10-10,ARV,Adult,Aurobindo Pharma Limited,"Efavirenz 600mg, tablets, 30 Tabs",Efavirenz,Generic,600mg,Tablet,30,5745,25909.95,4.51,0.15,"Aurobindo Unit III, India",Yes,488.0,4232.71,42.75,214 days 00:00:00.000000000
2782,SCMS-68980,South Africa,PMO - US,Direct Drop,DDP,Air,2010-03-18,3/19/2010,2010-08-24,2011-03-04,2011-03-04,ARV,Pediatric,Aurobindo Pharma Limited,"Lamivudine 10mg/ml, oral solution w/syringe, Bottle, 240 ml",Lamivudine,Generic,10mg/ml,Oral solution,240,6395,19185.0,3.0,0.01,"Aurobindo Unit III, India",Yes,4306.83476898982,11462.107118413907,41.36,351 days 00:00:00.000000000
2783,SCMS-259074,South Africa,PMO - US,Direct Drop,DDP,Truck,2014-09-11,3/9/2015,2015-03-09,2015-03-09,2015-03-09,ARV,Adult,PHARMACY DIRECT,"Zidovudine 300mg, tablets, 60 Tabs",Zidovudine,Generic,300mg,Tablet,60,7,126.22,18.03,0.3,"Aurobindo Unit III, India",No,4306.83476898982,11462.107118413907,0.13,179 days 00:00:00.000000000
2785,SCMS-177180,Haiti,PMO - US,Direct Drop,EXW,Ocean,2013-01-30,3/11/2013,2013-08-07,2013-08-07,2013-08-07,ARV,Pediatric,Aurobindo Pharma Limited,"Efavirenz 200mg, capsule, 90 Caps",Efavirenz,Generic,200mg,Capsule,90,3680,20240.0,5.5,0.06,"Aurobindo Unit III, India",Yes,6385.0,8768.76,25.04,189 days 00:00:00.000000000
2786,SCMS-177160,Haiti,PMO - US,Direct Drop,EXW,Ocean,2013-01-30,3/7/2013,2013-08-07,2013-08-07,2013-08-07,ARV,Adult,HETERO LABS LIMITED,"Efavirenz 600mg, tablets, 30 Tabs",Efavirenz,Generic,600mg,Tablet,30,71376,231258.24,3.24,0.11,"Hetero, Jadcherla, unit 5, IN",Yes,5864.0,7558.01,286.07,189 days 00:00:00.000000000
2787,SCMS-199283,South Africa,PMO - US,Direct Drop,DDP,Truck,2013-07-11,8/27/2014,2014-08-27,2014-08-27,2014-08-27,ARV,Adult,S. BUYS WHOLESALER,"Lopinavir/Ritonavir 200/50mg [Aluvia], tablets, 120 Tabs",Lopinavir/Ritonavir,Aluvia,200/50mg,Tablet,120,48,1236.47,25.76,0.21,ABBVIE Ludwigshafen Germany,No,4306.83476898982,11462.107118413907,1.53,412 days 00:00:00.000000000
2788,SCMS-253020,Zambia,PMO - US,Direct Drop,FCA,Air,2014-08-13,8/20/2014,2015-04-25,2015-04-25,2015-04-30,ARV,Pediatric,ABBVIE LOGISTICS (FORMERLY ABBOTT LOGISTICS BV),"Lopinavir/Ritonavir 80/20mg/ml [Kaletra], oral solution, cool, Bottle 5 x 60 ml",Lopinavir/Ritonavir,Kaletra,80/20mg/ml,Oral solution,300,2265,69807.3,30.82,0.1,ABBVIE (Abbott) Logis. UK,Yes,2272.0,14603.71,71.76,255 days 00:00:00.000000000
2790,SCMS-80900,Côte d'Ivoire,PMO - US,Direct Drop,CIP,Air,2010-07-19,8/2/2010,2010-09-08,2010-09-08,2010-09-08,ARV,Pediatric,BRISTOL-MYERS SQUIBB,"Didanosine 50mg [Videx], chewable tablets, 60 Tabs",Didanosine,Videx,50mg,Chewable/dispersible tablet,60,6000,57000.0,9.5,0.16,"BMS Meymac, France",Yes,1278.0,1742.12,122.89,51 days 00:00:00.000000000
2791,SCMS-233990,Haiti,PMO - US,Direct Drop,EXW,Air,2014-03-20,4/28/2014,2014-09-12,2014-09-12,2014-09-17,ARV,Adult,MICRO LABS LIMITED,"Efavirenz 600mg, tablets, 30 Tabs",Efavirenz,Generic,600mg,Tablet,30,29908,89125.84,2.98,0.1,"Micro labs, Verna, Goa, India",Yes,2423.0,14650.41,91.62,176 days 00:00:00.000000000
2792,SCMS-83730,South Africa,PMO - US,Direct Drop,DDP,Ocean,2010-08-31,9/24/2010,2011-03-04,2011-03-04,2011-03-04,ARV,Adult,Aurobindo Pharma Limited,"Zidovudine 300mg, tablets, 60 Tabs",Zidovudine,Generic,300mg,Tablet,60,87500,641375.0,7.33,0.12,"Aurobindo Unit III, India",Yes,4416.0,7334.83,1382.8,185 days 00:00:00.000000000
2794,SCMS-227720,Rwanda,PMO - US,Direct Drop,EXW,Air,2014-02-05,2/28/2014,2014-05-06,2014-05-06,2014-05-15,ARV,Pediatric,Aurobindo Pharma Limited,"Nevirapine 10mg/ml, oral suspension w/syringe, Bottle, 240 ml",Nevirapine,Generic,10mg/ml,Oral suspension,240,9720,14677.2,1.51,0.01,"Aurobindo Unit III, India",Yes,4365.0,11462.107118413907,15.09,90 days 00:00:00.000000000
2797,SCMS-170640,"Congo, DRC",PMO - US,Direct Drop,FCA,Air,2012-12-07,1/3/2013,2013-04-16,2013-04-16,2013-04-16,ARV,Pediatric,ABBVIE LOGISTICS (FORMERLY ABBOTT LOGISTICS BV),"Lopinavir/Ritonavir 80/20mg/ml [Kaletra], oral solution, cool, Bottle 5 x 60 ml",Lopinavir/Ritonavir,Kaletra,80/20mg/ml,Oral solution,300,60,1849.2,30.82,0.1,ABBVIE (Abbott) Logis. UK,Yes,113.0,2570.86,2.29,130 days 00:00:00.000000000
2798,SCMS-164560,Vietnam,PMO - US,Direct Drop,EXW,Air,2012-10-15,11/7/2012,2013-03-13,2013-03-13,2013-03-13,ARV,Pediatric,MYLAN LABORATORIES LTD (FORMERLY MATRIX LABORATORIES),"Lamivudine/Zidovudine 30/60mg, tablets, 60 Tabs",Lamivudine/Zidovudine,Generic,30/60mg,Tablet - FDC,60,1769,3714.9,2.1,0.04,Mylan (formerly Matrix) Nashik,Yes,1961.0,7308.37,4.6,149 days 00:00:00.000000000
2799,SCMS-75520,South Africa,PMO - US,Direct Drop,DDP,Air,2010-06-02,6/16/2010,2010-10-06,2010-10-06,2010-10-06,ARV,Pediatric,ASPEN PHARMACARE,"Abacavir 20mg/ml [Ziagen], oral solution, Bottle, 240 ml",Abacavir,Ziagen,20mg/ml,Oral solution,240,26000,392080.0,15.08,0.06,GSK Mississauga (Canada),Yes,4306.83476898982,7707.42,845.32,126 days 00:00:00.000000000
2800,SCMS-278621,South Africa,PMO - US,Direct Drop,DDP,Truck,2015-02-23,5/7/2015,2015-07-15,2015-07-15,2015-07-15,ARV,Adult,PHARMACY DIRECT,"Efavirenz/Emtricitabine/Tenofovir Disoproxil Fumarate 600/200/300mg, tablets, 30 Tabs",Efavirenz/Emtricitabine/Tenofovir Disoproxil Fumarate,Generic,600/200/300mg,Tablet - FDC,30,9,342.83,38.09,1.27,Mylan (formerly Matrix) Nashik,Yes,4306.83476898982,11462.107118413907,0.4,142 days 00:00:00.000000000
2801,SCMS-268601,Rwanda,PMO - US,Direct Drop,FCA,Air,2014-10-09,12/12/2014,2015-05-12,2015-05-12,2015-05-12,ARV,Pediatric,SWORDS LABORATORIES,"Atazanavir 200mg [Reyataz], capsules, 60 Caps",Atazanavir,Reyataz,200mg,Capsule,60,1080,43869.6,40.62,0.68,Bristol-Myers Squibb Anagni IT,Yes,282.0,1028.1,45.1,215 days 00:00:00.000000000
2802,SCMS-82750,Tanzania,PMO - US,Direct Drop,EXW,Air,2010-08-18,8/25/2010,2010-10-22,2010-10-22,2010-10-22,ARV,Adult,MYLAN LABORATORIES LTD (FORMERLY MATRIX LABORATORIES),"Efavirenz/Emtricitabine/Tenofovir Disoproxil Fumarate 600/200/300mg, tablets, 30 Tabs",Efavirenz/Emtricitabine/Tenofovir Disoproxil Fumarate,Generic,600/200/300mg,Tablet - FDC,30,9000,179100.0,19.9,0.66,Mylan (formerly Matrix) Nashik,Yes,1081.0,5834.1,386.14,65 days 00:00:00.000000000
2803,SCMS-58220,Uganda,PMO - US,Direct Drop,CIP,Air,2009-11-25,12/2/2009,2010-03-04,2010-03-04,2010-03-04,ARV,Adult,MERCK SHARP & DOHME IDEA GMBH (FORMALLY MERCK SHARP & DOHME B.V.),"Indinavir 400mg [Crixivan], capsules, 180 Caps",Indinavir,Crixivan,400mg,Capsule,180,75,3750.0,50.0,0.28,"MSD, Haarlem, NL",Yes,19.0,435.0,7.35,99 days 00:00:00.000000000
2804,SCMS-74010,Haiti,PMO - US,Direct Drop,CIP,Air,2010-05-04,5/25/2010,2010-08-05,2010-08-05,2010-08-05,ARV,Pediatric,BRISTOL-MYERS SQUIBB,"Didanosine 2g [Videx], powder for oral solution 10mg/ml, reconstitute to 200 ml",Didanosine,Videx,2g,Powder for oral solution,200,192,2417.28,12.59,0.06,"BMS Meymac, France",Yes,4306.83476898982,11462.107118413907,5.21,93 days 00:00:00.000000000
2806,SCMS-49641,South Africa,PMO - US,Direct Drop,DDP,Truck,2009-05-07,7/21/2009,2009-08-05,2009-08-05,2009-08-05,ARV,Pediatric,S. BUYS WHOLESALER,"Abacavir 20mg/ml [Ziagen], oral solution, Bottle, 240 ml",Abacavir,Ziagen,20mg/ml,Oral solution,240,599,11964.63,19.97,0.08,GSK Mississauga (Canada),Yes,4306.83476898982,11462.107118413907,23.45,90 days 00:00:00.000000000
2808,SCMS-83350,Rwanda,PMO - US,Direct Drop,CIP,Air,2010-08-13,9/28/2010,2010-12-12,2010-12-12,2010-12-12,ARV,Adult,MYLAN LABORATORIES LTD (FORMERLY MATRIX LABORATORIES),"Efavirenz/Lamivudine/Tenofovir Disoproxil Fumarate 600/300/300mg, tablets, 30 Tabs",Efavirenz/Lamivudine/Tenofovir Disoproxil Fumarate,Generic,600/300/300mg,Tablet - FDC,30,9653,168734.44,17.48,0.58,Mylan (formerly Matrix) Nashik,Yes,4306.83476898982,11462.107118413907,363.79,121 days 00:00:00.000000000
2809,SCMS-104370,South Africa,PMO - US,Direct Drop,DDP,Ocean,2011-03-10,4/1/2011,2011-08-15,2011-08-15,2011-08-15,ARV,Adult,Aurobindo Pharma Limited,"Zidovudine 300mg, tablets, 60 Tabs",Zidovudine,Generic,300mg,Tablet,60,2452,17899.6,7.3,0.12,"Aurobindo Unit III, India",Yes,127.0,47101.63,29.53,158 days 00:00:00.000000000
2810,SCMS-259079,South Africa,PMO - US,Direct Drop,DDP,Truck,2014-09-11,10/9/2014,2015-08-24,2015-08-24,2015-08-24,ARV,Adult,PHARMACY DIRECT,"Didanosine 250mg, delayed-release capsules, 30 Caps",Didanosine,Generic,250mg,Delayed-release capsules,30,6,71.03,11.84,0.39,"Aurobindo Unit III, India",Yes,4306.83476898982,11462.107118413907,0.07,347 days 00:00:00.000000000
2814,SCMS-68940,South Africa,PMO - US,Direct Drop,DDP,Air,2010-03-18,3/19/2010,2010-09-07,2010-09-07,2010-09-07,ARV,Adult,Aurobindo Pharma Limited,"Efavirenz 600mg, tablets, 30 Tabs",Efavirenz,Generic,600mg,Tablet,30,11510,53751.7,4.67,0.16,"Aurobindo Unit III, India",Yes,993.0,4263.07,115.89,173 days 00:00:00.000000000
2815,SCMS-97850,Vietnam,PMO - US,Direct Drop,EXW,Air,2011-01-17,2/15/2011,2011-06-22,2011-06-22,2011-06-22,ARV,Adult,MYLAN LABORATORIES LTD (FORMERLY MATRIX LABORATORIES),"Lamivudine 150mg, tablets, 60 Tabs",Lamivudine,Generic,150mg,Tablet,60,20000,40000.0,2.0,0.03,Mylan (formerly Matrix) Nashik,Yes,2806.0,18207.5,66.0,156 days 00:00:00.000000000
2816,SCMS-75660,South Africa,PMO - US,Direct Drop,DDP,Ocean,2010-06-02,6/17/2010,2010-10-12,2010-12-15,2010-12-15,ARV,Adult,Aurobindo Pharma Limited,"Efavirenz 600mg, tablets, 30 Tabs",Efavirenz,Generic,600mg,Tablet,30,12000,54120.0,4.51,0.15,"Aurobindo Unit III, India",Yes,4306.83476898982,11462.107118413907,116.68,196 days 00:00:00.000000000
2817,SCMS-87910,Guyana,PMO - US,Direct Drop,DDU,Air,2010-09-28,10/1/2010,2011-03-04,2011-03-04,2011-03-04,ARV,Pediatric,IDIS LIMITED,"Didanosine 25mg [Videx], chewable tablets, 60 Tabs",Didanosine,Videx,25mg,Chewable/dispersible tablet,60,270,12501.0,46.3,0.77,"BMS Meymac, France",Yes,59.0,180.0,26.95,157 days 00:00:00.000000000
2818,SCMS-240220,Haiti,PMO - US,Direct Drop,EXW,Air,2014-05-11,6/2/2014,2014-07-18,2014-07-18,2014-07-31,ARV,Pediatric,Aurobindo Pharma Limited,"Abacavir 20mg/ml, oral solution, Bottle, 240 ml",Abacavir,Generic,20mg/ml,Oral solution,240,375,2561.25,6.83,0.03,"Aurobindo Unit III, India",Yes,300.0,2949.23,2.63,68 days 00:00:00.000000000
2820,SCMS-57140,Vietnam,PMO - US,Direct Drop,EXW,Air,2009-10-20,11/13/2009,2010-03-15,2010-03-15,2010-03-15,ARV,Adult,Aurobindo Pharma Limited,"Lamivudine/Nevirapine/Zidovudine 150/200/300mg, tablets, 60 Tabs",Lamivudine/Nevirapine/Zidovudine,Generic,150/300/200mg,Tablet - FDC,60,16300,181745.0,11.15,0.19,"Aurobindo Unit III, India",Yes,2011.0,11648.31,356.22,146 days 00:00:00.000000000
2822,SCMS-259075,South Africa,PMO - US,Direct Drop,DDP,Truck,2014-09-11,5/11/2015,2015-05-12,2015-05-12,2015-05-12,ARV,Adult,PHARMACY DIRECT,"Didanosine 400mg, delayed-release capsules, 30 Caps",Didanosine,Generic,400mg,Delayed-release capsules,30,7,99.53,14.22,0.47,"Aurobindo Unit III, India",No,4306.83476898982,11462.107118413907,0.1,243 days 00:00:00.000000000
2823,SCMS-166120,Vietnam,PMO - US,Direct Drop,EXW,Air,2012-10-15,11/9/2012,2013-01-29,2013-01-29,2013-01-29,ARV,Pediatric,Aurobindo Pharma Limited,"Lamivudine 10mg/ml, oral solution w/syringe, Bottle, 240 ml",Lamivudine,Generic,10mg/ml,Oral solution,240,464,858.4,1.85,0.01,"Aurobindo Unit III, India",Yes,437.0,1222.31,1.06,106 days 00:00:00.000000000
2825,SCMS-57130,Vietnam,PMO - US,Direct Drop,EXW,Air,2009-10-20,11/13/2009,2010-03-19,2010-03-19,2010-03-19,ARV,Adult,Aurobindo Pharma Limited,"Lamivudine 150mg, tablets, 60 Tabs",Lamivudine,Generic,150mg,Tablet,60,24480,58752.0,2.4,0.04,"Aurobindo Unit III, India",Yes,3536.0,20910.43,115.15,150 days 00:00:00.000000000
2827,SCMS-212700,Nigeria,PMO - US,Direct Drop,EXW,Air,2013-10-17,11/4/2013,2013-12-17,2013-12-17,2013-12-20,ARV,Adult,MYLAN LABORATORIES LTD (FORMERLY MATRIX LABORATORIES),"Zidovudine 300mg, tablets, 60 Tabs",Zidovudine,Generic,300mg,Tablet,60,10000,65000.0,6.5,0.11,Mylan (formerly Matrix) Nashik,Yes,574.0,4760.43,66.82,61 days 00:00:00.000000000
2828,SCMS-83330,Rwanda,PMO - US,Direct Drop,CIP,Air,2010-08-13,9/27/2010,2011-01-07,2011-01-07,2011-01-07,ARV,Adult,CIPLA LIMITED,"Lopinavir/Ritonavir 200/50mg, tablets, 120 Tabs",Lopinavir/Ritonavir,Generic,200/50mg,Tablet,120,1202,41228.6,34.3,0.29,Cipla Ltd A-42 MIDC Mahar. IN,Yes,4306.83476898982,11462.107118413907,88.89,147 days 00:00:00.000000000
2830,SCMS-262980,Haiti,PMO - US,Direct Drop,EXW,Ocean,2014-10-22,1/7/2015,2015-04-09,2015-04-09,2015-04-13,ARV,Adult,HETERO LABS LIMITED,"Lamivudine/Tenofovir Disoproxil Fumarate 300/300mg, tablets, 30 Tabs",Lamivudine/Tenofovir Disoproxil Fumarate,Generic,300/300mg,Tablet - FDC,30,36831,170159.22,4.62,0.15,Hetero Unit III Hyderabad IN,Yes,17826.0,20526.23,174.92,169 days 00:00:00.000000000
2832,SCMS-75480,South Africa,PMO - US,Direct Drop,DDP,Air,2010-06-02,6/17/2010,2010-12-13,2010-12-11,2010-12-11,ARV,Pediatric,Aurobindo Pharma Limited,"Nevirapine 10mg/ml, oral suspension w/syringe, Bottle, 240 ml",Nevirapine,Generic,10mg/ml,Oral suspension,240,2162,6810.3,3.15,0.01,"Aurobindo Unit III, India",Yes,838.0,4876.31,14.68,192 days 00:00:00.000000000
2834,SCMS-199283,South Africa,PMO - US,Direct Drop,DDP,Truck,2013-07-11,8/27/2014,2014-08-27,2014-08-27,2014-08-27,ARV,Adult,S. BUYS WHOLESALER,"Efavirenz 600mg, tablets, 30 Tabs",Efavirenz,Generic,600mg,Tablet,30,115,1923.5,16.73,0.56,Hetero Unit III Hyderabad IN,Yes,4306.83476898982,11462.107118413907,2.38,412 days 00:00:00.000000000
2836,SCMS-84411,Rwanda,PMO - US,Direct Drop,CIP,Air,2010-09-03,9/27/2010,2011-02-09,2011-02-09,2011-02-09,ARV,Adult,CIPLA LIMITED,"Lopinavir/Ritonavir 200/50mg, tablets, 120 Tabs",Lopinavir/Ritonavir,Generic,200/50mg,Tablet,120,2486,85269.8,34.3,0.29,Cipla Ltd A-42 MIDC Mahar. IN,Yes,4354.0,11462.107118413907,183.84,159 days 00:00:00.000000000
2838,SCMS-285060,Cameroon,PMO - US,Direct Drop,CIP,Air,2015-02-19,5/1/2015,2015-08-26,2015-08-26,2015-08-26,ARV,Adult,MERCK SHARP & DOHME IDEA GMBH (FORMALLY MERCK SHARP & DOHME B.V.),"Raltegravir 400mg [Isentress], tablets, 60 Tabs",Raltegravir,Isentress,400mg,Tablet,60,120,6660.0,55.5,0.92,"MSD, Haarlem, NL",Yes,4306.83476898982,11462.107118413907,7.84,188 days 00:00:00.000000000
2839,SCMS-204300,Cameroon,PMO - US,Direct Drop,EXW,Air,2013-08-19,8/23/2013,2013-10-18,2013-10-26,2013-10-29,ARV,Adult,Aurobindo Pharma Limited,"Nevirapine 200mg, tablets, 60 Tabs",Nevirapine,Generic,200mg,Tablet,60,34595,77838.75,2.25,0.04,"Aurobindo Unit III, India",Yes,3642.0,31434.31,96.29,68 days 00:00:00.000000000
2840,SCMS-68980,South Africa,PMO - US,Direct Drop,DDP,Air,2010-03-18,3/19/2010,2010-08-24,2010-08-24,2010-08-24,ARV,Pediatric,Aurobindo Pharma Limited,"Lamivudine 10mg/ml, oral solution w/syringe, Bottle, 240 ml",Lamivudine,Generic,10mg/ml,Oral solution,240,8474,25422.0,3.0,0.01,"Aurobindo Unit III, India",Yes,3206.0,2154.51,54.81,159 days 00:00:00.000000000
2841,SCMS-61200,Ethiopia,PMO - US,Direct Drop,EXW,Air,2009-12-23,12/29/2009,2010-02-09,2010-02-09,2010-02-09,ARV,Adult,STRIDES ARCOLAB LIMITED,"Lamivudine/Stavudine 150/30mg, tablets, 60 Tabs",Lamivudine/Stavudine,Generic,150/30mg,Tablet - FDC,60,71596,241278.52,3.37,0.06,"Strides, Bangalore, India.",Yes,3652.0,15236.52,520.2,48 days 00:00:00.000000000
2842,SCMS-137552,Rwanda,PMO - US,Direct Drop,EXW,Air,2012-01-13,5/31/2012,2012-08-07,2012-08-07,2012-08-07,ARV,Adult,MYLAN LABORATORIES LTD (FORMERLY MATRIX LABORATORIES),"Abacavir 300mg, tablets, 60 Tabs",Abacavir,Generic,300mg,Tablet,60,46530,581159.7,12.49,0.21,Mylan (formerly Matrix) Nashik,Yes,4810.0,27894.81,814.79,207 days 00:00:00.000000000
2843,SCMS-111240,Nigeria,PMO - US,Direct Drop,EXW,Air,2011-05-23,6/15/2011,2011-09-23,2011-09-23,2011-09-23,ACT,ACT,NOVARTIS PHARMA SERVICES AG,"Artemether/Lumefantrine 20/120mg [Coartem], scored tablets, Blister 30 x 24 Tabs",Artemether/Lumefantrine,Coartem,20/120mg,Tablet - FDC + blister,720,1000,39000.0,39.0,0.05,"Novartis Pharma Suffern, USA",Yes,711.0,5433.21,64.35,123 days 00:00:00.000000000
2844,SCMS-277340,Vietnam,PMO - US,Direct Drop,FCA,Air,2015-02-13,3/4/2015,2015-07-15,2015-07-15,2015-07-15,ARV,Adult,ABBVIE LOGISTICS (FORMERLY ABBOTT LOGISTICS BV),"Ritonavir 100mg [Norvir], film coated tablets, 30 Tabs",Ritonavir,Norvir,100mg,Tablet,30,400,9304.0,23.26,0.78,ABBVIE Ludwigshafen Germany,Yes,40.0,642.45,10.95,152 days 00:00:00.000000000
2846,SCMS-123520,Vietnam,PMO - US,Direct Drop,EXW,Air,2011-09-21,10/4/2011,2012-03-01,2012-03-01,2012-03-01,ARV,Adult,Aurobindo Pharma Limited,"Lamivudine/Nevirapine/Zidovudine 150/200/300mg, tablets, 60 Tabs",Lamivudine/Nevirapine/Zidovudine,Generic,150/300/200mg,Tablet - FDC,60,30000,313500.0,10.45,0.17,"Aurobindo Unit III, India",Yes,10210.0,17392.05,517.28,162 days 00:00:00.000000000
2849,SCMS-259071,South Africa,PMO - US,Direct Drop,DDP,Truck,2014-09-11,11/28/2014,2014-11-28,2014-11-28,2014-11-28,ARV,Adult,PHARMACY DIRECT,"Zidovudine 300mg, tablets, 60 Tabs",Zidovudine,Generic,300mg,Tablet,60,12,216.37,18.03,0.3,"Aurobindo Unit III, India",No,4306.83476898982,11462.107118413907,0.22,78 days 00:00:00.000000000
2851,SCMS-219220,Mozambique,PMO - US,Direct Drop,EXW,Air,2013-12-11,12/17/2013,2014-05-02,2014-05-02,2014-05-07,ARV,Adult,HETERO LABS LIMITED,"Lamivudine/Nevirapine/Zidovudine 150/200/300mg, tablets, 60 Tabs",Lamivudine/Nevirapine/Zidovudine,Generic,150/300/200mg,Tablet - FDC,60,23040,186854.4,8.11,0.14,Hetero Unit III Hyderabad IN,Yes,3138.0,16537.12,192.09,142 days 00:00:00.000000000
2852,SCMS-54980,South Africa,PMO - US,Direct Drop,DDP,Truck,2009-10-08,10/15/2009,2009-10-19,2009-10-19,2009-10-19,ARV,Pediatric,S. BUYS WHOLESALER,"Stavudine 1mg/ml [Zerit], powder for oral solution, Bottle, 200 ml",Stavudine,Zerit,1mg/ml,Powder for oral solution,200,2200,3914.05,1.78,0.01,"BMS Meymac, France",No,4306.83476898982,11462.107118413907,7.67,11 days 00:00:00.000000000
2854,SCMS-129870,Rwanda,PMO - US,Direct Drop,EXW,Air,2011-12-06,12/13/2011,2012-01-24,2012-01-26,2012-01-26,ARV,Adult,Aurobindo Pharma Limited,"Lamivudine/Tenofovir Disoproxil Fumarate 300/300mg, tablets, 30 Tabs",Lamivudine/Tenofovir Disoproxil Fumarate,Generic,300/300mg,Tablet - FDC,30,41286,220880.1,5.35,0.18,"Aurobindo Unit VII, IN",Yes,4027.0,28833.91,309.67,51 days 00:00:00.000000000
2855,SCMS-84940,Rwanda,PMO - US,Direct Drop,EXW,Ocean,2010-09-03,9/29/2010,2011-04-27,2011-04-27,2011-04-27,ARV,Adult,MYLAN LABORATORIES LTD (FORMERLY MATRIX LABORATORIES),"Lamivudine/Tenofovir Disoproxil Fumarate 300/300mg, tablets, 30 Tabs",Lamivudine/Tenofovir Disoproxil Fumarate,Generic,300/300mg,Tablet - FDC,30,117359,997551.5,8.5,0.28,Mylan (formerly Matrix) Nashik,Yes,10329.0,32530.22,2150.72,236 days 00:00:00.000000000
2856,SCMS-56540,Vietnam,PMO - US,Direct Drop,EXW,Air,2009-10-20,11/11/2009,2010-08-23,2010-08-23,2010-08-23,ARV,Adult,Aurobindo Pharma Limited,"Lamivudine/Nevirapine/Zidovudine 150/200/300mg, tablets, 60 Tabs",Lamivudine/Nevirapine/Zidovudine,Generic,150/300/200mg,Tablet - FDC,60,20500,228575.0,11.15,0.19,"Aurobindo Unit III, India",Yes,2904.0,14223.39,448.01,307 days 00:00:00.000000000
2857,SCMS-49631,South Africa,PMO - US,Direct Drop,DDP,Truck,2009-05-07,7/21/2009,2009-09-14,2009-10-09,2009-10-09,ARV,Adult,S. BUYS WHOLESALER,"Efavirenz 600mg, tablets, 30 Tabs",Efavirenz,Generic,600mg,Tablet,30,9612,183096.09,19.05,0.64,"Cipla, Goa, India",Yes,4306.83476898982,11462.107118413907,358.87,155 days 00:00:00.000000000
2859,SCMS-72390,Ethiopia,PMO - US,Direct Drop,EXW,Air,2010-04-28,4/29/2010,2011-02-14,2011-02-14,2011-02-14,ARV,Adult,Aurobindo Pharma Limited,"Didanosine 250mg, delayed-release capsules, 30 Caps",Didanosine,Generic,250mg,Delayed-release capsules,30,2600,33800.0,13.0,0.43,"Aurobindo Unit III, India",Yes,236.0,1131.48,72.87,292 days 00:00:00.000000000
2860,SCMS-93580,South Africa,PMO - US,Direct Drop,DDP,Ocean,2010-11-26,12/14/2010,2011-04-08,2011-04-08,2011-04-08,ARV,Adult,CIPLA LIMITED,"Tenofovir Disoproxil Fumarate 300mg, tablets, 30 Tabs",Tenofovir Disoproxil Fumarate,Generic,300mg,Tablet,30,137654,944306.44,6.86,0.23,"Cipla, Goa, India",Yes,9147.0,11314.2,1558.11,133 days 00:00:00.000000000
2861,SCMS-233940,Haiti,PMO - US,Direct Drop,EXW,Air,2014-03-20,4/29/2014,2014-07-14,2014-07-14,2014-07-16,ARV,Pediatric,Aurobindo Pharma Limited,"Nevirapine 10mg/ml, oral suspension w/syringe, Bottle, 240 ml",Nevirapine,Generic,10mg/ml,Oral suspension,240,705,1064.55,1.51,0.01,"Aurobindo Unit III, India",Yes,346.0,3429.78,1.09,116 days 00:00:00.000000000
2862,SCMS-198780,Tanzania,PMO - US,Direct Drop,EXW,Air,2013-07-03,7/16/2013,2013-09-24,2013-09-24,2013-09-24,ARV,Adult,Aurobindo Pharma Limited,"Lamivudine/Nevirapine/Zidovudine 150/200/300mg, tablets, 60 Tabs",Lamivudine/Nevirapine/Zidovudine,Generic,150/300/200mg,Tablet - FDC,60,36426,296143.38,8.13,0.14,"Aurobindo Unit III, India",Yes,4609.0,17581.92,366.33,83 days 00:00:00.000000000
2864,SCMS-210120,Vietnam,PMO - US,Direct Drop,EXW,Air,2013-10-04,10/10/2013,2014-04-23,2014-04-23,2014-04-23,ARV,Adult,HETERO LABS LIMITED,"Lamivudine 150mg, tablets, 60 Tabs",Lamivudine,Generic,150mg,Tablet,60,14011,25920.35,1.85,0.03,Hetero Unit III Hyderabad IN,Yes,1953.0,3658.08,32.06,201 days 00:00:00.000000000
2866,SCMS-259074,South Africa,PMO - US,Direct Drop,DDP,Truck,2014-09-11,3/9/2015,2015-03-09,2015-03-09,2015-03-09,ARV,Adult,PHARMACY DIRECT,"Didanosine 250mg, delayed-release capsules, 30 Caps",Didanosine,Generic,250mg,Delayed-release capsules,30,1,11.02,11.02,0.37,"Aurobindo Unit III, India",No,4306.83476898982,11462.107118413907,0.01,179 days 00:00:00.000000000
2867,SCMS-132180,Haiti,PMO - US,Direct Drop,EXW,Air,2011-12-07,12/30/2011,2012-01-18,2012-01-18,2012-01-18,ANTM,Malaria,AMSTELFARMA B.V.,"Mefloquine 250mg (as hydrochloride), tablets, 100 Tabs",Mefloquine (as hydrochloride),Generic,250mg,Tablet,100,100,8905.0,89.05,0.89,"Medochemie Factory A, CY",Yes,1173.0,7019.07,12.48,42 days 00:00:00.000000000
2868,SCMS-47770,Tanzania,PMO - US,Direct Drop,CIP,Air,2009-06-11,6/29/2009,2009-11-27,2009-11-27,2009-11-27,ARV,Adult,BRISTOL-MYERS SQUIBB,"Didanosine EC 250mg [Videx EC], delayed-release capsules, Blister 3 x 10 Caps",Didanosine EC,Videx EC,250mg,Delayed-release capsules - blister,30,18544,340096.96,18.34,0.61,"BMS Meymac, France",Yes,1478.0,1312.2,666.59,169 days 00:00:00.000000000
2869,SCMS-262840,Haiti,PMO - US,Direct Drop,EXW,Ocean,2014-10-22,12/24/2014,2015-07-03,2015-07-03,2015-07-13,ARV,Pediatric,MYLAN LABORATORIES LTD (FORMERLY MATRIX LABORATORIES),"Abacavir/Lamivudine 60/30mg, tablets, 60 Tabs",Abacavir/Lamivudine,Generic,60/30mg,Tablet - FDC,60,3300,13035.0,3.95,0.07,Mylan (formerly Matrix) Nashik,Yes,16350.0,16028.78,13.4,254 days 00:00:00.000000000
2870,SCMS-83790,South Africa,PMO - US,Direct Drop,DDP,Ocean,2010-08-31,9/24/2010,2011-02-01,2011-05-03,2011-05-03,ARV,Pediatric,Aurobindo Pharma Limited,"Efavirenz 200mg, capsule, 90 Caps",Efavirenz,Generic,200mg,Capsule,90,1515,15119.7,9.98,0.11,"Aurobindo Unit III, India",Yes,201.0,4134.92,32.6,245 days 00:00:00.000000000
2871,SCMS-98320,Ethiopia,PMO - US,Direct Drop,EXW,Air,2011-01-13,2/1/2011,2011-10-31,2011-10-31,2011-10-31,ARV,Adult,Aurobindo Pharma Limited,"Didanosine 400mg, delayed-release capsules, 30 Caps",Didanosine,Generic,400mg,Delayed-release capsules,30,2225,44500.0,20.0,0.67,"Aurobindo Unit III, India",Yes,174.0,2052.97,73.42,291 days 00:00:00.000000000
2872,SCMS-117230,Tanzania,PMO - US,Direct Drop,FCA,Air,2011-07-08,8/4/2011,2012-03-29,2012-03-29,2012-03-29,ARV,Pediatric,LAWRENCE LABORATORIES (SUBSIDIARY OF BRISTOL MYERS SQUIBB),"Didanosine 100mg [Videx],chewable tablets, 60 Tabs",Didanosine,Videx,100mg,Chewable/dispersible tablet,60,4132,52683.0,12.75,0.21,Bristol-Myers Squibb Anagni IT,Yes,1598.0,12689.71,86.93,265 days 00:00:00.000000000
2873,SCMS-164660,Vietnam,PMO - US,Direct Drop,EXW,Air,2012-10-15,11/7/2012,2013-05-16,2013-05-16,2013-05-16,ARV,Adult,STRIDES ARCOLAB LIMITED,"Lamivudine/Nevirapine/Zidovudine 150/200/300mg, tablets, 60 Tabs",Lamivudine/Nevirapine/Zidovudine,Generic,150/300/200mg,Tablet - FDC,60,21858,184044.36,8.42,0.14,"Strides, Bangalore, India.",Yes,2777.0,4461.72,227.66,213 days 00:00:00.000000000
2876,SCMS-138580,Haiti,PMO - US,Direct Drop,EXW,Air,2012-01-06,2/24/2012,2012-04-22,2012-04-22,2012-04-22,ARV,Pediatric,Aurobindo Pharma Limited,"Nevirapine 50mg, dispersible tablets (tablets for oral suspension), 30 Tabs",Nevirapine,Generic,50mg,Chewable/dispersible tablet,30,2894,3617.5,1.25,0.04,"Aurobindo Unit III, India",Yes,1486.0,12749.39,5.07,107 days 00:00:00.000000000
2881,SCMS-259077,South Africa,PMO - US,Direct Drop,DDP,Truck,2014-09-11,10/9/2014,2015-07-24,2015-07-24,2015-07-24,ARV,Adult,PHARMACY DIRECT,"Etravirine 100mg [Intelence], tablets, 120 Tabs",Etravirine,Intelence,100mg,Tablet,120,27,742.84,27.51,0.23,"Janssen-Cilag, Latina, IT",Yes,4306.83476898982,11462.107118413907,0.76,316 days 00:00:00.000000000
2883,SCMS-84930,Rwanda,PMO - US,Direct Drop,EXW,Ocean,2010-09-03,9/27/2010,2011-12-13,2011-12-13,2011-12-13,ARV,Adult,CIPLA LIMITED,"Lopinavir/Ritonavir 200/50mg, tablets, 120 Tabs",Lopinavir/Ritonavir,Generic,200/50mg,Tablet,120,23240,776216.0,33.4,0.28,Cipla Ltd A-42 MIDC Mahar. IN,Yes,6853.0,81246.12,1673.52,466 days 00:00:00.000000000
2884,SCMS-238552,South Africa,PMO - US,Direct Drop,DDP,Truck,2014-04-30,8/5/2014,2014-08-05,2014-08-05,2014-08-05,ARV,Adult,PHARMACY DIRECT,"Darunavir 300mg [Prezista], tablets, 120 Tabs",Darunavir,Prezista,300mg,Tablet,120,36,2509.54,69.71,0.58,"Janssen-Cilag, Latina, IT",Yes,4306.83476898982,11462.107118413907,2.58,97 days 00:00:00.000000000
2886,SCMS-219200,Tanzania,PMO - US,Direct Drop,EXW,Air,2013-12-13,12/27/2013,2014-04-25,2014-04-25,2014-04-25,ARV,Adult,HETERO LABS LIMITED,"Zidovudine 300mg, tablets, 60 Tabs",Zidovudine,Generic,300mg,Tablet,60,63200,347600.0,5.5,0.09,Hetero Unit III Hyderabad IN,Yes,4007.0,23397.41,357.33,133 days 00:00:00.000000000
2887,SCMS-104100,South Africa,PMO - US,Direct Drop,DDP,Ocean,2011-03-10,3/28/2011,2012-01-12,2012-01-27,2012-01-27,ARV,Adult,CIPLA LIMITED,"Nevirapine 200mg, tablets, 60 Tabs",Nevirapine,Generic,200mg,Tablet,60,37870,103006.4,2.72,0.05,"Cipla, Goa, India",Yes,4121.0,4957.81,169.96,323 days 00:00:00.000000000
2888,SCMS-210541,Haiti,PMO - US,Direct Drop,EXW,Ocean,2013-08-21,2/3/2014,2014-05-09,2014-05-09,2014-05-12,ARV,Pediatric,MYLAN LABORATORIES LTD (FORMERLY MATRIX LABORATORIES),"Lamivudine/Nevirapine/Zidovudine 30/50/60mg, dispersible tablets, 60 Tabs",Lamivudine/Nevirapine/Zidovudine,Generic,30/50/60mg,Chewable/dispersible tablet - FDC,60,889,3200.4,3.6,0.06,Mylan (formerly Matrix) Nashik,Yes,94.0,2350.55,3.96,261 days 00:00:00.000000000
2889,SCMS-54980,South Africa,PMO - US,Direct Drop,DDP,Truck,2009-10-08,10/15/2009,2009-10-19,2009-10-19,2009-10-19,ARV,Pediatric,S. BUYS WHOLESALER,"Nevirapine 10mg/ml [Viramune], oral suspension, Bottle, 240 ml",Nevirapine,Viramune,10mg/ml,Oral suspension,240,220,3442.16,15.65,0.07,Boehringer Ingelheim Roxane US,No,4306.83476898982,11462.107118413907,6.75,11 days 00:00:00.000000000
2890,SCMS-129500,Rwanda,PMO - US,Direct Drop,EXW,Air,2011-11-30,3/14/2012,2012-06-29,2012-06-29,2012-06-29,ARV,Adult,CIPLA LIMITED,"Lopinavir/Ritonavir 200/50mg, tablets, 120 Tabs",Lopinavir/Ritonavir,Generic,200/50mg,Tablet,120,2074,74746.96,36.04,0.3,Cipla Ltd A-42 MIDC Mahar. IN,Yes,627.0,6072.8,104.8,212 days 00:00:00.000000000
2891,SCMS-211070,Zambia,PMO - US,Direct Drop,EXW,Air,2013-10-11,10/21/2013,2013-12-23,2013-12-23,2014-04-09,ARV,Adult,Aurobindo Pharma Limited,"Lamivudine 150mg, tablets, 60 Tabs",Lamivudine,Generic,150mg,Tablet,60,20000,43000.0,2.15,0.04,"Aurobindo Unit III, India",Yes,1044.0,5145.69,44.2,73 days 00:00:00.000000000
2892,SCMS-210020,Vietnam,PMO - US,Direct Drop,FCA,Air,2013-10-04,10/10/2013,2014-04-04,2014-04-04,2014-04-05,ARV,Adult,ABBVIE LOGISTICS (FORMERLY ABBOTT LOGISTICS BV),"Lopinavir/Ritonavir 200/50mg [Aluvia], tablets, 120 Tabs",Lopinavir/Ritonavir,Aluvia,200/50mg,Tablet,120,1969,119754.58,60.82,0.51,ABBVIE Ludwigshafen Germany,Yes,484.0,1565.1,148.14,182 days 00:00:00.000000000
2895,SCMS-188801,Zambia,PMO - US,Direct Drop,EXW,Air,2013-04-19,7/10/2013,2013-10-17,2013-10-17,2013-11-06,ARV,Adult,Aurobindo Pharma Limited,"Emtricitabine/Tenofovir Disoproxil Fumarate 200/300mg, tablets, 30 Tabs",Emtricitabine/Tenofovir Disoproxil Fumarate,Generic,200/300mg,Tablet - FDC,30,11811,69684.9,5.9,0.2,"Aurobindo Unit III, India",Yes,1184.0,5904.94,86.2,181 days 00:00:00.000000000
2896,SCMS-145520,Vietnam,PMO - US,Direct Drop,EXW,Air,2012-04-11,6/12/2012,2012-08-22,2012-08-22,2012-08-22,ARV,Pediatric,Aurobindo Pharma Limited,"Efavirenz 50mg, capsule, 30 Caps",Efavirenz,Generic,50mg,Capsule,30,3000,6720.0,2.24,0.07,"Aurobindo Unit III, India",Yes,436.0,1238.16,9.42,133 days 00:00:00.000000000
2897,SCMS-48840,Rwanda,PMO - US,Direct Drop,CIP,Air,2009-06-30,7/16/2009,2009-11-23,2009-11-23,2009-11-23,ARV,Adult,HETERO LABS LIMITED,"Nevirapine 200mg, tablets, 60 Tabs",Nevirapine,Generic,200mg,Tablet,60,29925,92468.25,3.09,0.05,Hetero Unit III Hyderabad IN,Yes,1041.0,730.82,181.24,146 days 00:00:00.000000000
2898,SCMS-174390,Vietnam,PMO - US,Direct Drop,EXW,Air,2013-01-10,1/22/2013,2013-04-25,2013-04-25,2013-04-25,ARV,Adult,HETERO LABS LIMITED,"Tenofovir Disoproxil Fumarate 300mg, tablets, 30 Tabs",Tenofovir Disoproxil Fumarate,Generic,300mg,Tablet,30,34640,122972.0,3.55,0.12,Hetero Unit III Hyderabad IN,Yes,2804.0,9759.55,152.12,105 days 00:00:00.000000000
2899,SCMS-227720,Rwanda,PMO - US,Direct Drop,EXW,Air,2014-02-05,2/28/2014,2014-05-06,2014-05-06,2014-05-15,ARV,Pediatric,Aurobindo Pharma Limited,"Nevirapine 10mg/ml, oral suspension w/syringe, Bottle, 240 ml",Nevirapine,Generic,10mg/ml,Oral suspension,240,9690,14631.9,1.51,0.01,"Aurobindo Unit III, India",Yes,3790.0,66260.33,15.04,90 days 00:00:00.000000000
2901,SCMS-62460,Vietnam,PMO - US,Direct Drop,EXW,Air,2009-01-04,1/12/2010,2010-03-29,2010-03-29,2010-03-29,ARV,Adult,MYLAN LABORATORIES LTD (FORMERLY MATRIX LABORATORIES),"Abacavir 300mg, tablets, 60 Tabs",Abacavir,Generic,300mg,Tablet,60,100,1750.0,17.5,0.29,Mylan (formerly Matrix) Nashik,Yes,2128.0,7784.92,3.77,449 days 00:00:00.000000000
2903,SCMS-240191,Haiti,PMO - US,Direct Drop,EXW,Ocean,2014-05-11,6/26/2014,2014-10-28,2014-10-28,2014-11-19,ARV,Pediatric,Aurobindo Pharma Limited,"Zidovudine 10mg/ml, oral solution, Bottle, 240 ml",Zidovudine,Generic,10mg/ml,Oral solution,240,2040,4080.0,2.0,0.01,"Aurobindo Unit III, India",Yes,4306.83476898982,11462.107118413907,4.19,170 days 00:00:00.000000000
2904,SCMS-123600,Vietnam,PMO - US,Direct Drop,EXW,Air,2011-09-21,10/4/2011,2012-02-18,2012-02-18,2012-02-18,ARV,Adult,Aurobindo Pharma Limited,"Abacavir 300mg, tablets, 60 Tabs",Abacavir,Generic,300mg,Tablet,60,112,1618.4,14.45,0.24,"Aurobindo Unit III, India",Yes,1701.0,4288.83,2.67,150 days 00:00:00.000000000
2905,SCMS-62460,Vietnam,PMO - US,Direct Drop,EXW,Air,2009-01-04,1/12/2010,2010-03-29,2010-03-29,2010-03-29,ARV,Adult,MYLAN LABORATORIES LTD (FORMERLY MATRIX LABORATORIES),"Efavirenz 600mg, tablets, 30 Tabs",Efavirenz,Generic,600mg,Tablet,30,11592,52048.08,4.49,0.15,Mylan (formerly Matrix) Nashik,No,4306.83476898982,11462.107118413907,112.22,449 days 00:00:00.000000000
2906,SCMS-141660,Nigeria,PMO - US,Direct Drop,EXW,Air,2012-03-09,4/16/2012,2012-10-20,2012-10-20,2012-10-20,ARV,Adult,MYLAN LABORATORIES LTD (FORMERLY MATRIX LABORATORIES),"Atazanavir/Ritonavir 300/100mg, tablets, 30 Tabs",Atazanavir/Ritonavir,Generic,300/100mg,Tablet,30,10150,228375.0,22.5,0.75,Mylan (formerly Matrix) Nashik,Yes,1360.0,7665.38,320.18,225 days 00:00:00.000000000
2907,SCMS-267020,South Africa,PMO - US,Direct Drop,DDP,Truck,2014-10-29,12/10/2014,2014-12-10,2014-12-10,2014-12-10,ARV,Adult,S. BUYS WHOLESALER,"Nevirapine 200mg, tablets, 60 Tabs",Nevirapine,Generic,200mg,Tablet,60,143,2313.12,16.18,0.27,"Cipla, Goa, India",Yes,4306.83476898982,11462.107118413907,2.72,42 days 00:00:00.000000000
2908,SCMS-199710,Vietnam,PMO - US,Direct Drop,FCA,Air,2013-07-11,7/30/2013,2014-01-08,2014-01-08,2014-01-08,ARV,Adult,ABBVIE LOGISTICS (FORMERLY ABBOTT LOGISTICS BV),"Ritonavir 100mg [Norvir], film coated tablets, 30 Tabs",Ritonavir,Norvir,100mg,Tablet,30,319,7419.94,23.26,0.78,ABBVIE Ludwigshafen Germany,Yes,1736.0,5265.22,9.18,181 days 00:00:00.000000000
2909,SCMS-76980,Tanzania,PMO - US,Direct Drop,EXW,Air,2010-06-21,6/24/2010,2010-08-07,2010-08-09,2010-08-09,ARV,Adult,Aurobindo Pharma Limited,"Nevirapine 200mg, tablets, 60 Tabs",Nevirapine,Generic,200mg,Tablet,60,28663,74523.8,2.6,0.04,"Aurobindo Unit III, India",Yes,3380.0,17603.58,160.67,49 days 00:00:00.000000000
2910,SCMS-215580,Mozambique,PMO - US,Direct Drop,FCA,Air,2013-11-12,11/26/2013,2014-03-07,2014-03-07,2014-03-15,ARV,Adult,ABBVIE LOGISTICS (FORMERLY ABBOTT LOGISTICS BV),"Ritonavir 100mg [Norvir], film coated tablets, 60 Tabs",Ritonavir,Norvir,100mg,Tablet,60,120,822.0,6.85,0.11,ABBVIE Ludwigshafen Germany,Yes,22.0,828.76,0.85,115 days 00:00:00.000000000
2913,SCMS-57730,Côte d'Ivoire,PMO - US,Direct Drop,FCA,Air,2009-11-05,11/23/2009,2010-03-05,2010-03-05,2010-03-05,ARV,Adult,Hoffmann-La Roche ltd Basel,"Saquinavir 500mg [Invirase], tablets, 120 Tabs",Saquinavir,Invirase,500mg,Tablet,120,1500,149780.99,99.85,0.83,Roche Basel,Yes,271.0,2527.94,322.93,120 days 00:00:00.000000000
2914,SCMS-188500,Vietnam,PMO - US,Direct Drop,EXW,Air,2013-05-03,5/10/2013,2013-10-23,2013-10-23,2013-10-24,ARV,Adult,MYLAN LABORATORIES LTD (FORMERLY MATRIX LABORATORIES),"Efavirenz/Lamivudine/Tenofovir Disoproxil Fumarate 600/300/300mg, tablets, 30 Tabs",Efavirenz/Lamivudine/Tenofovir Disoproxil Fumarate,Generic,600/300/300mg,Tablet - FDC,30,84000,965160.0,11.49,0.38,Mylan (formerly Matrix) Nashik,Yes,9479.0,14402.92,1193.9,173 days 00:00:00.000000000
2917,SCMS-198140,Haiti,PMO - US,Direct Drop,EXW,Air,2013-06-25,7/22/2013,2013-08-30,2013-08-30,2013-08-30,ARV,Adult,MYLAN LABORATORIES LTD (FORMERLY MATRIX LABORATORIES),"Atazanavir/Ritonavir 300/100mg, tablets, 30 Tabs",Atazanavir/Ritonavir,Generic,300/100mg,Tablet,30,5000,100000.0,20.0,0.67,Mylan (formerly Matrix) Nashik,Yes,670.0,4909.72,123.7,66 days 00:00:00.000000000
2918,SCMS-49090,Rwanda,PMO - US,Direct Drop,CIP,Air,2009-06-30,7/16/2009,2010-07-01,2010-07-01,2010-07-01,ARV,Adult,HETERO LABS LIMITED,"Nevirapine 200mg, tablets, 60 Tabs",Nevirapine,Generic,200mg,Tablet,60,66825,206489.25,3.09,0.05,Hetero Unit III Hyderabad IN,Yes,3845.0,20194.78,404.72,366 days 00:00:00.000000000
2920,SCMS-56300,Vietnam,PMO - US,Direct Drop,EXW,Air,2009-10-20,11/3/2009,2010-03-20,2010-03-20,2010-03-20,ARV,Adult,MYLAN LABORATORIES LTD (FORMERLY MATRIX LABORATORIES),"Zidovudine 300mg, tablets, 60 Tabs",Zidovudine,Generic,300mg,Tablet,60,336,2520.0,7.5,0.12,Mylan (formerly Matrix) Nashik,Yes,120.0,9013.85,4.94,151 days 00:00:00.000000000
2921,SCMS-93550,South Africa,PMO - US,Direct Drop,DDP,Ocean,2010-11-26,12/14/2010,2011-06-13,2011-06-13,2011-06-13,ARV,Adult,Aurobindo Pharma Limited,"Tenofovir Disoproxil Fumarate 300mg, tablets, 30 Tabs",Tenofovir Disoproxil Fumarate,Generic,300mg,Tablet,30,43280,287812.0,6.65,0.22,"Aurobindo Unit III, India",Yes,4040.0,6121.42,474.89,199 days 00:00:00.000000000
2924,SCMS-103290,Tanzania,PMO - US,Direct Drop,FCA,Air,2011-01-27,4/14/2011,2011-06-27,2011-06-27,2011-06-27,ARV,Adult,LAWRENCE LABORATORIES (SUBSIDIARY OF BRISTOL MYERS SQUIBB),"Didanosine EC 250mg [Videx EC], delayed-release capsules, Blister 3 x 10 Caps",Didanosine EC,Videx EC,250mg,Delayed-release capsules - blister,30,2098,38477.32,18.34,0.61,Bristol-Myers Squibb Anagni IT,Yes,140.0,1870.73,63.49,151 days 00:00:00.000000000
2925,SCMS-71370,South Africa,PMO - US,Direct Drop,DDP,Truck,2010-04-19,4/21/2010,2010-05-31,2010-05-31,2010-05-31,ARV,Pediatric,S. BUYS WHOLESALER,"Efavirenz 50mg, capsule, 30 Caps",Efavirenz,Generic,50mg,Capsule,30,300,1046.28,3.49,0.12,"Aurobindo Unit III, India",Yes,4306.83476898982,11462.107118413907,2.26,42 days 00:00:00.000000000
2927,SCMS-259075,South Africa,PMO - US,Direct Drop,DDP,Truck,2014-09-11,5/11/2015,2015-05-12,2015-05-12,2015-05-12,ARV,Adult,PHARMACY DIRECT,"Saquinavir 200mg [Invirase], capsules, 270 Caps",Saquinavir,Invirase,200mg,Capsule,270,3,166.54,55.51,0.21,Roche Madrid,Yes,4306.83476898982,11462.107118413907,0.17,243 days 00:00:00.000000000
2928,SCMS-62340,Mozambique,PMO - US,Direct Drop,CIP,Air,2009-12-23,1/29/2010,2010-06-23,2010-06-23,2010-06-23,ARV,Adult,INTERNATIONAL HEALTHCARE DISTRIBUTORS,"Ritonavir 100mg [Norvir], capsules, cool, 84 Caps",Ritonavir,Norvir,100mg,Capsule,84,320,3312.0,10.35,0.12,ABBVIE (Abbott) Logis. UK,Yes,4306.83476898982,11462.107118413907,7.14,182 days 00:00:00.000000000
2929,SCMS-204990,Côte d'Ivoire,PMO - US,Direct Drop,FCA,Air,2013-07-30,9/2/2013,2013-11-29,2013-11-29,2013-12-02,ARV,Pediatric,ABBVIE LOGISTICS (FORMERLY ABBOTT LOGISTICS BV),"Lopinavir/Ritonavir 100/25mg [Aluvia], tablets, 60 Tabs",Lopinavir/Ritonavir,Generic,100/25mg,Tablet,60,7850,46629.0,5.94,0.1,ABBVIE Ludwigshafen Germany,Yes,909.0,6020.53,57.68,122 days 00:00:00.000000000
2930,SCMS-188700,Vietnam,PMO - US,Direct Drop,EXW,Air,2013-05-03,5/15/2013,2013-09-25,2013-09-25,2013-09-25,ARV,Adult,HETERO LABS LIMITED,"Abacavir 300mg, tablets, 60 Tabs",Abacavir,Generic,300mg,Tablet,60,771,9444.75,12.25,0.2,Hetero Unit III Hyderabad IN,Yes,136.0,678.96,11.68,145 days 00:00:00.000000000
2933,SCMS-83770,South Africa,PMO - US,Direct Drop,DDP,Ocean,2010-08-31,9/24/2010,2011-04-26,2011-04-26,2011-04-26,ARV,Adult,Aurobindo Pharma Limited,"Lamivudine 150mg, tablets, 60 Tabs",Lamivudine,Generic,150mg,Tablet,60,152535,361507.95,2.37,0.04,"Aurobindo Unit III, India",Yes,7698.0,11372.23,779.41,238 days 00:00:00.000000000
2934,SCMS-259078,South Africa,PMO - US,Direct Drop,DDP,Truck,2014-09-11,10/9/2014,2015-07-24,2015-07-24,2015-07-24,ARV,Adult,PHARMACY DIRECT,"Emtricitabine/Tenofovir Disoproxil Fumarate 200/300mg, tablets, 30 Tabs",Emtricitabine/Tenofovir Disoproxil Fumarate,Generic,200/300mg,Tablet - FDC,30,12,281.25,23.44,0.78,"Aurobindo Unit III, India",Yes,4306.83476898982,11462.107118413907,0.29,316 days 00:00:00.000000000
2935,SCMS-87770,Vietnam,PMO - US,Direct Drop,EXW,Air,2010-09-30,10/18/2010,2011-02-09,2011-02-09,2011-02-09,ARV,Adult,HETERO LABS LIMITED,"Lamivudine/Nevirapine/Stavudine 150/200/30mg, tablets, 60 Tabs",Lamivudine/Nevirapine/Stavudine,Generic,150/200/30mg,Tablet - FDC,60,19760,94848.0,4.8,0.08,Hetero Unit III Hyderabad IN,Yes,3998.0,12974.12,204.49,132 days 00:00:00.000000000
2937,SCMS-276200,Guyana,PMO - US,Direct Drop,EXW,Air,2015-01-02,2/12/2015,2015-06-16,2015-06-16,2015-06-24,ARV,Adult,HETERO LABS LIMITED,"Emtricitabine/Tenofovir Disoproxil Fumarate 200/300mg, tablets, 30 Tabs",Emtricitabine/Tenofovir Disoproxil Fumarate,Generic,200/300mg,Tablet - FDC,30,3715,20766.85,5.59,0.19,Hetero Unit III Hyderabad IN,Yes,385.0,3248.6,24.44,165 days 00:00:00.000000000
2938,SCMS-199283,South Africa,PMO - US,Direct Drop,DDP,Truck,2013-07-11,8/27/2014,2014-08-27,2014-08-27,2014-08-27,ARV,Adult,S. BUYS WHOLESALER,"Lamivudine/Zidovudine 150/300mg, tablets, 60 Tabs",Lamivudine/Zidovudine,Generic,150/300mg,Tablet - FDC,60,46,1517.44,32.99,0.55,Hetero Unit III Hyderabad IN,No,4306.83476898982,11462.107118413907,1.88,412 days 00:00:00.000000000
2939,SCMS-253021,Zambia,PMO - US,Direct Drop,FCA,Air,2014-08-13,8/20/2014,2015-06-09,2015-06-09,2015-06-09,ARV,Pediatric,ABBVIE LOGISTICS (FORMERLY ABBOTT LOGISTICS BV),"Lopinavir/Ritonavir 80/20mg/ml [Kaletra], oral solution, cool, Bottle 5 x 60 ml",Lopinavir/Ritonavir,Kaletra,80/20mg/ml,Oral solution,300,2266,69838.12,30.82,0.1,ABBVIE (Abbott) Logis. UK,Yes,2277.0,13894.08,71.79,300 days 00:00:00.000000000
2940,SCMS-176290,Haiti,PMO - US,Direct Drop,FCA,Air,2013-01-16,2/5/2013,2013-06-04,2013-06-04,2013-06-04,ARV,Pediatric,ABBVIE LOGISTICS (FORMERLY ABBOTT LOGISTICS BV),"Lopinavir/Ritonavir 80/20mg/ml [Kaletra], oral solution, cool, Bottle 5 x 60 ml",Lopinavir/Ritonavir,Kaletra,80/20mg/ml,Oral solution,300,100,3082.0,30.82,0.1,ABBVIE (Abbott) Logis. UK,Yes,164.0,2419.33,3.81,139 days 00:00:00.000000000
2944,SCMS-259075,South Africa,PMO - US,Direct Drop,DDP,Truck,2014-09-11,5/11/2015,2015-05-12,2015-05-12,2015-05-12,ARV,Adult,PHARMACY DIRECT,"Didanosine 400mg, delayed-release capsules, 30 Caps",Didanosine,Generic,400mg,Delayed-release capsules,30,3,42.65,14.22,0.47,"Aurobindo Unit III, India",No,4306.83476898982,11462.107118413907,0.04,243 days 00:00:00.000000000
2945,SCMS-62490,Vietnam,PMO - US,Direct Drop,EXW,Air,2009-01-04,1/12/2010,2010-03-15,2010-03-15,2010-03-15,ARV,Adult,CIPLA LIMITED,"Lamivudine/Nevirapine/Stavudine 150/200/30mg, tablets, 60 Tabs",Lamivudine/Nevirapine/Stavudine,Generic,150/200/30mg,Tablet - FDC,60,19920,114340.8,5.74,0.1,"Cipla, Goa, India",Yes,1936.0,5314.56,246.52,435 days 00:00:00.000000000
2946,SCMS-199287,South Africa,PMO - US,Direct Drop,DDP,Truck,2013-07-11,8/13/2014,2014-08-13,2014-08-13,2014-08-13,ARV,Pediatric,S. BUYS WHOLESALER,"Lopinavir/Ritonavir 80/20mg/ml [Kaletra], oral solution, cool, Bottle 5 x 60 ml",Lopinavir/Ritonavir,Kaletra,80/20mg/ml,Oral solution,300,2,46.9,23.45,0.08,ABBVIE (Abbott) Logis. UK,Yes,4306.83476898982,11462.107118413907,0.06,398 days 00:00:00.000000000
2947,SCMS-51251,South Africa,PMO - US,Direct Drop,DDP,Truck,2009-07-29,8/7/2009,2009-10-07,2009-10-07,2009-10-07,ARV,Pediatric,S. BUYS WHOLESALER,"Stavudine 1mg/ml, powder for oral solution, 200 ml",Stavudine,Generic,1mg/ml,Oral solution,200,500,1303.53,2.61,0.01,"Aurobindo Unit III, India",Yes,4306.83476898982,11462.107118413907,2.55,70 days 00:00:00.000000000
2948,SCMS-253440,Namibia,PMO - US,Direct Drop,EXW,Air,2014-07-30,8/29/2014,2014-11-19,2014-11-19,2014-11-19,ARV,Adult,HETERO LABS LIMITED,"Lamivudine/Zidovudine 150/300mg, tablets, 60 Tabs",Lamivudine/Zidovudine,Generic,150/300mg,Tablet - FDC,60,26663,176242.43,6.61,0.11,"Hetero, Jadcherla, unit 5, IN",Yes,4233.0,26663.64,181.18,112 days 00:00:00.000000000
2949,SCMS-199283,South Africa,PMO - US,Direct Drop,DDP,Truck,2013-07-11,8/27/2014,2014-08-27,2014-08-27,2014-08-27,ARV,Adult,S. BUYS WHOLESALER,"Efavirenz 600mg, tablets, 30 Tabs",Efavirenz,Generic,600mg,Tablet,30,143,2391.83,16.73,0.56,Hetero Unit III Hyderabad IN,No,4306.83476898982,11462.107118413907,2.96,412 days 00:00:00.000000000
2950,SCMS-68720,South Africa,PMO - US,Direct Drop,DDP,Air,2010-03-18,3/19/2010,2010-07-19,2010-07-29,2010-07-29,ARV,Adult,CIPLA LIMITED,"Tenofovir Disoproxil Fumarate 300mg, tablets, 30 Tabs",Tenofovir Disoproxil Fumarate,Generic,300mg,Tablet,30,47625,372427.5,7.82,0.26,"Cipla, Goa, India",Yes,3243.0,1881.24,802.95,133 days 00:00:00.000000000
2951,SCMS-83770,South Africa,PMO - US,Direct Drop,DDP,Ocean,2010-08-31,9/24/2010,2011-04-26,2011-04-26,2011-04-26,ARV,Adult,Aurobindo Pharma Limited,"Efavirenz 600mg, tablets, 30 Tabs",Efavirenz,Generic,600mg,Tablet,30,32280,146228.4,4.53,0.15,"Aurobindo Unit III, India",Yes,7017.0,11372.23,315.27,238 days 00:00:00.000000000
2953,SCMS-68740,South Africa,PMO - US,Direct Drop,DDP,Air,2010-03-18,3/19/2010,2010-09-01,2010-09-01,2010-09-01,ARV,Adult,CIPLA LIMITED,"Tenofovir Disoproxil Fumarate 300mg, tablets, 30 Tabs",Tenofovir Disoproxil Fumarate,Generic,300mg,Tablet,30,26991,211069.62,7.82,0.26,"Cipla, Goa, India",Yes,1842.0,5298.03,455.07,167 days 00:00:00.000000000
2954,SCMS-199289,South Africa,PMO - US,Direct Drop,DDP,Truck,2013-07-11,8/29/2014,2014-08-29,2014-08-29,2014-08-29,ARV,Pediatric,S. BUYS WHOLESALER,"Lamivudine 10mg/ml, oral solution w/syringe, Bottle, 240 ml",Lamivudine,Generic,10mg/ml,Oral solution,240,29,228.8,7.89,0.03,"Aurobindo Unit III, India",Yes,4306.83476898982,11462.107118413907,0.28,414 days 00:00:00.000000000
2955,SCMS-238553,South Africa,PMO - US,Direct Drop,DDP,Truck,2014-04-30,8/28/2014,2014-08-28,2014-08-28,2014-08-28,ARV,Pediatric,PHARMACY DIRECT,"Efavirenz 50mg, capsule, 30 Caps",Efavirenz,Generic,50mg,Capsule,30,39,117.24,3.01,0.1,"Aurobindo Unit III, India",Yes,4306.83476898982,11462.107118413907,0.12,120 days 00:00:00.000000000
2956,SCMS-199289,South Africa,PMO - US,Direct Drop,DDP,Truck,2013-07-11,8/29/2014,2014-08-29,2014-08-29,2014-08-29,ARV,Adult,S. BUYS WHOLESALER,"Tenofovir Disoproxil Fumarate 300mg, tablets, 30 Tabs",Tenofovir Disoproxil Fumarate,Generic,300mg,Tablet,30,206,4365.52,21.19,0.71,"Aurobindo Unit III, India",Yes,4306.83476898982,11462.107118413907,5.4,414 days 00:00:00.000000000
2957,SCMS-103490,South Africa,PMO - US,Direct Drop,DDP,Ocean,2011-03-10,3/24/2011,2011-09-02,2011-09-02,2011-09-02,ARV,Pediatric,Aurobindo Pharma Limited,"Efavirenz 200mg, capsule, 90 Caps",Efavirenz,Generic,200mg,Capsule,90,25000,204250.0,8.17,0.09,"Aurobindo Unit III, India",Yes,3313.0,4689.6,337.01,176 days 00:00:00.000000000
2959,SCMS-259073,South Africa,PMO - US,Direct Drop,DDP,Truck,2014-09-11,2/12/2015,2015-02-12,2015-02-12,2015-02-12,ARV,Adult,PHARMACY DIRECT,"Lamivudine/Zidovudine 150/300mg, tablets, 60 Tabs",Lamivudine/Zidovudine,Generic,150/300mg,Tablet - FDC,60,19,407.56,21.45,0.36,"Aurobindo Unit III, India",Yes,4306.83476898982,11462.107118413907,0.42,154 days 00:00:00.000000000
2960,SCMS-108100,Vietnam,PMO - US,Direct Drop,EXW,Air,2011-04-21,5/2/2011,2011-08-11,2011-08-11,2011-08-11,ARV,Adult,MYLAN LABORATORIES LTD (FORMERLY MATRIX LABORATORIES),"Nevirapine 200mg, tablets, 60 Tabs",Nevirapine,Generic,200mg,Tablet,60,25000,65000.0,2.6,0.04,Mylan (formerly Matrix) Nashik,Yes,3098.0,12745.06,107.25,112 days 00:00:00.000000000
2961,SCMS-156320,Vietnam,PMO - US,Direct Drop,EXW,Air,2012-07-25,8/15/2012,2012-12-05,2012-12-05,2012-12-05,ARV,Adult,HETERO LABS LIMITED,"Lamivudine/Zidovudine 150/300mg, tablets, 60 Tabs",Lamivudine/Zidovudine,Generic,150/300mg,Tablet - FDC,60,14842,105081.36,7.08,0.12,Hetero Unit III Hyderabad IN,Yes,1364.0,2348.57,147.32,133 days 00:00:00.000000000
2964,SCMS-245070,Zimbabwe,PMO - US,Direct Drop,EXW,Air,2014-06-17,6/19/2014,2014-08-20,2014-08-20,2014-08-20,ARV,Pediatric,STRIDES ARCOLAB LIMITED,"Efavirenz 200mg, scored tablets, 90 Tabs",Efavirenz,Generic,200mg,Tablet,90,14164,131725.2,9.3,0.1,"Strides, Bangalore, India.",Yes,884.0,8280.73,135.41,64 days 00:00:00.000000000
2966,SCMS-233950,Haiti,PMO - US,Direct Drop,EXW,Ocean,2014-03-20,4/29/2014,2014-10-20,2014-10-20,2014-10-24,ARV,Pediatric,Aurobindo Pharma Limited,"Nevirapine 10mg/ml, oral suspension w/syringe, Bottle, 240 ml",Nevirapine,Generic,10mg/ml,Oral suspension,240,1295,1955.45,1.51,0.01,"Aurobindo Unit III, India",Yes,536.0,1893.24,2.01,214 days 00:00:00.000000000
2967,SCMS-123600,Vietnam,PMO - US,Direct Drop,EXW,Air,2011-09-21,10/4/2011,2012-02-18,2012-02-18,2012-02-18,ARV,Adult,Aurobindo Pharma Limited,"Efavirenz 600mg, tablets, 30 Tabs",Efavirenz,Generic,600mg,Tablet,30,3548,14369.4,4.05,0.13,"Aurobindo Unit III, India",No,4306.83476898982,11462.107118413907,23.71,150 days 00:00:00.000000000
2968,SCMS-233981,Haiti,PMO - US,Direct Drop,EXW,Ocean,2014-03-20,5/30/2014,2014-10-28,2014-10-28,2014-11-21,ARV,Adult,CIPLA LIMITED,"Lamivudine/Nevirapine/Zidovudine 150/200/300mg, tablets, 60 Tabs",Lamivudine/Nevirapine/Zidovudine,Generic,150/300/200mg,Tablet - FDC,60,16435,133123.5,8.1,0.13,"Cipla, Goa, India",Yes,4306.83476898982,11462.107118413907,136.85,222 days 00:00:00.000000000
2970,SCMS-177182,Haiti,PMO - US,Direct Drop,EXW,Air,2013-01-30,3/11/2013,2013-06-10,2013-06-10,2013-06-10,ARV,Pediatric,Aurobindo Pharma Limited,"Nevirapine 10mg/ml, oral suspension w/syringe, Bottle, 240 ml",Nevirapine,Generic,10mg/ml,Oral suspension,240,2052,3098.52,1.51,0.01,"Aurobindo Unit III, India",Yes,908.0,6438.91,3.83,131 days 00:00:00.000000000
2971,SCMS-70750,Zambia,PMO - US,Direct Drop,CIP,Air,2010-04-14,5/25/2010,2010-07-08,2010-07-08,2010-07-08,ARV,Adult,INTERNATIONAL HEALTHCARE DISTRIBUTORS,"Lopinavir/Ritonavir 200/50mg [Aluvia], tablets, 120 Tabs",Lopinavir/Ritonavir,Aluvia,200/50mg,Tablet,120,10000,369100.0,36.91,0.31,ABBVIE Ludwigshafen Germany,Yes,2294.0,1100.2,795.78,85 days 00:00:00.000000000
2974,SCMS-56200,Vietnam,PMO - US,Direct Drop,FCA,Air,2009-10-20,11/5/2009,2010-03-11,2010-03-11,2010-03-11,ARV,Adult,ABBVIE LOGISTICS (FORMERLY ABBOTT LOGISTICS BV),"Lopinavir/Ritonavir 200/50mg [Aluvia], tablets, 120 Tabs",Lopinavir/Ritonavir,Aluvia,200/50mg,Tablet,120,4280,351816.0,82.2,0.68,ABBVIE Ludwigshafen Germany,Yes,1063.0,11167.45,689.56,142 days 00:00:00.000000000
2975,SCMS-93520,South Africa,PMO - US,Direct Drop,DDP,Ocean,2010-11-26,12/6/2010,2011-06-26,2011-04-07,2011-04-07,ARV,Adult,Aurobindo Pharma Limited,"Tenofovir Disoproxil Fumarate 300mg, tablets, 30 Tabs",Tenofovir Disoproxil Fumarate,Generic,300mg,Tablet,30,64269,427388.85,6.65,0.22,"Aurobindo Unit III, India",Yes,5999.0,13829.58,705.19,132 days 00:00:00.000000000
2976,SCMS-259076,South Africa,PMO - US,Direct Drop,DDP,Truck,2014-09-11,6/2/2015,2015-06-02,2015-06-02,2015-06-02,ARV,Adult,PHARMACY DIRECT,"Didanosine 250mg, delayed-release capsules, 30 Caps",Didanosine,Generic,250mg,Delayed-release capsules,30,4,44.07,11.02,0.37,"Aurobindo Unit III, India",Yes,4306.83476898982,11462.107118413907,0.05,264 days 00:00:00.000000000
2977,SCMS-236750,Tanzania,PMO - US,Direct Drop,EXW,Air,2014-04-17,4/18/2014,2014-06-24,2014-06-24,2014-06-24,ARV,Pediatric,STRIDES ARCOLAB LIMITED,"Efavirenz 200mg, scored tablets, 90 Tabs",Efavirenz,Generic,200mg,Tablet,90,15041,139881.3,9.3,0.1,"Strides, Bangalore, India.",Yes,949.0,4673.77,143.8,68 days 00:00:00.000000000
2978,SCMS-237810,Ghana,PMO - US,Direct Drop,EXW,Air,2014-04-12,5/23/2014,2014-11-10,2014-11-10,2014-11-12,ARV,Adult,Aurobindo Pharma Limited,"Lamivudine/Nevirapine/Zidovudine 150/200/300mg, tablets, 60 Tabs",Lamivudine/Nevirapine/Zidovudine,Generic,150/300/200mg,Tablet - FDC,60,28853,236594.6,8.2,0.14,"Aurobindo Unit III, India",Yes,3612.0,18256.1,243.22,212 days 00:00:00.000000000
2979,SCMS-123540,Vietnam,PMO - US,Direct Drop,EXW,Air,2011-09-21,10/3/2011,2012-04-16,2012-04-16,2012-04-16,ARV,Adult,MYLAN LABORATORIES LTD (FORMERLY MATRIX LABORATORIES),"Efavirenz/Lamivudine/Tenofovir Disoproxil Fumarate 600/300/300mg, tablets, 30 Tabs",Efavirenz/Lamivudine/Tenofovir Disoproxil Fumarate,Generic,600/300/300mg,Tablet - FDC,30,6549,92340.9,14.1,0.47,Mylan (formerly Matrix) Nashik,Yes,1208.0,3306.51,152.36,208 days 00:00:00.000000000
2982,SCMS-210150,Vietnam,PMO - US,Direct Drop,EXW,Air,2013-10-04,10/10/2013,2014-04-23,2014-04-23,2014-04-23,ARV,Adult,HETERO LABS LIMITED,"Abacavir 300mg, tablets, 60 Tabs",Abacavir,Generic,300mg,Tablet,60,1436,16442.2,11.45,0.19,Hetero Unit III Hyderabad IN,Yes,2832.0,7474.2,20.34,201 days 00:00:00.000000000
2983,SCMS-261420,Vietnam,PMO - US,Direct Drop,EXW,Air,2014-10-24,10/30/2014,2015-03-19,2015-03-19,2015-03-19,ARV,Adult,MYLAN LABORATORIES LTD (FORMERLY MATRIX LABORATORIES),"Lamivudine/Nevirapine/Zidovudine 150/200/300mg, tablets, 60 Tabs",Lamivudine/Nevirapine/Zidovudine,Generic,150/300/200mg,Tablet - FDC,60,9000,72900.0,8.1,0.13,Mylan (formerly Matrix) Nashik,Yes,4306.83476898982,11462.107118413907,85.8,146 days 00:00:00.000000000
2984,SCMS-177150,Haiti,PMO - US,Direct Drop,EXW,Ocean,2013-01-30,3/7/2013,2013-07-25,2013-07-25,2013-07-25,ARV,Adult,HETERO LABS LIMITED,"Efavirenz/Lamivudine/Tenofovir Disoproxil Fumarate 600/300/300mg, tablets, 30 Tabs",Efavirenz/Lamivudine/Tenofovir Disoproxil Fumarate,Generic,600/300/300mg,Tablet - FDC,30,54090,567945.0,10.5,0.35,Hetero Unit III Hyderabad IN,Yes,7140.0,7992.56,702.55,176 days 00:00:00.000000000
2985,SCMS-47760,Tanzania,PMO - US,Direct Drop,CIP,Air,2009-06-11,6/29/2009,2009-10-21,2009-10-21,2009-10-21,ARV,Adult,BRISTOL-MYERS SQUIBB,"Didanosine EC 400mg [Videx EC], delayed-release capsules, Blister 3 x 10 Caps",Didanosine EC,Videx EC,400mg,Delayed-release capsules - blister,30,1000,23670.0,23.67,0.79,"BMS Meymac, France",Yes,335.0,888.0,46.39,132 days 00:00:00.000000000
2986,SCMS-240580,Zimbabwe,PMO - US,Direct Drop,EXW,Air Charter,2014-04-01,5/26/2014,2014-07-23,2014-07-23,2014-07-29,ARV,Adult,Aurobindo Pharma Limited,"Lamivudine/Tenofovir Disoproxil Fumarate 300/300mg, tablets, 30 Tabs",Lamivudine/Tenofovir Disoproxil Fumarate,Generic,300/300mg,Tablet - FDC,30,35955,167190.75,4.65,0.16,"Aurobindo Unit VII, IN",Yes,3520.0,23014.35,171.87,113 days 00:00:00.000000000
2987,SCMS-98041,Guatemala,PMO - US,Direct Drop,DDU,Air,2011-01-17,1/25/2011,2012-05-21,2012-05-21,2012-05-21,ARV,Pediatric,IDIS LIMITED,"Didanosine 50mg [Videx], chewable tablets, 60 Tabs",Didanosine,Videx,50mg,Chewable/dispersible tablet,60,161,12174.82,75.62,1.26,Bristol-Myers Squibb Anagni IT,Yes,4306.83476898982,11462.107118413907,20.09,490 days 00:00:00.000000000
2989,SCMS-206530,Côte d'Ivoire,PMO - US,Direct Drop,FCA,Air,2013-08-09,9/17/2013,2014-02-07,2014-02-07,2014-02-10,ARV,Pediatric,ABBVIE LOGISTICS (FORMERLY ABBOTT LOGISTICS BV),"Lopinavir/Ritonavir 100/25mg [Aluvia], tablets, 60 Tabs",Lopinavir/Ritonavir,Generic,100/25mg,Tablet,60,4600,27324.0,5.94,0.1,ABBVIE Ludwigshafen Germany,Yes,535.0,5924.33,33.8,182 days 00:00:00.000000000
2992,SCMS-189060,"Congo, DRC",PMO - US,Direct Drop,FCA,Air,2013-04-23,5/23/2013,2013-11-20,2013-11-20,2013-11-26,ARV,Pediatric,ABBVIE LOGISTICS (FORMERLY ABBOTT LOGISTICS BV),"Lopinavir/Ritonavir 80/20mg/ml [Kaletra], oral solution, cool, Bottle 5 x 60 ml",Lopinavir/Ritonavir,Kaletra,80/20mg/ml,Oral solution,300,30,924.6,30.82,0.1,ABBVIE (Abbott) Logis. UK,Yes,56.0,460.9,1.14,211 days 00:00:00.000000000
2993,SCMS-71450,Tanzania,PMO - US,Direct Drop,EXW,Air,2010-04-15,4/23/2010,2010-12-01,2010-12-01,2010-12-01,ARV,Pediatric,EMCURE PHARMACEUTICALS LTD,"Atazanavir 150mg, capsules, 60 Caps",Atazanavir,Generic,150mg,Capsule,60,426,11114.34,26.09,0.43,"Emcure Plot No.P-2, I.T-B.T. Park, Phase II, MIDC, Hinjwadi, Pune, India",Yes,45.0,1013.19,23.96,230 days 00:00:00.000000000
2995,SCMS-259078,South Africa,PMO - US,Direct Drop,DDP,Truck,2014-09-11,10/9/2014,2015-07-24,2015-07-24,2015-07-24,ARV,Pediatric,PHARMACY DIRECT,"Atazanavir 150mg [Reyataz], capsules, 60 Caps",Atazanavir,Reyataz,150mg,Capsule,60,9,143.1,15.9,0.26,"BMS Evansville, US",Yes,4306.83476898982,11462.107118413907,0.15,316 days 00:00:00.000000000
2996,SCMS-180000,Guyana,PMO - US,Direct Drop,EXW,Air,2013-02-07,3/6/2013,2013-04-18,2013-04-18,2013-04-18,ARV,Pediatric,Aurobindo Pharma Limited,"Zidovudine 100mg, capsules, 100 Caps",Zidovudine,Generic,100mg,Capsule,100,172,791.2,4.6,0.05,"Aurobindo Unit III, India",Yes,33.0,882.81,0.98,70 days 00:00:00.000000000
2997,SCMS-68980,South Africa,PMO - US,Direct Drop,DDP,Air,2010-03-18,3/19/2010,2010-08-24,2010-09-20,2010-09-20,ARV,Adult,Aurobindo Pharma Limited,"Lamivudine 150mg, tablets, 60 Tabs",Lamivudine,Generic,150mg,Tablet,60,33338,84345.14,2.53,0.04,"Aurobindo Unit III, India",Yes,1791.0,1791.42,181.85,186 days 00:00:00.000000000
3001,SCMS-258570,Haiti,PMO - US,Direct Drop,FCA,Air,2014-09-24,11/14/2014,2015-03-11,2015-03-11,2015-03-16,ARV,Adult,ABBVIE LOGISTICS (FORMERLY ABBOTT LOGISTICS BV),"Lopinavir/Ritonavir 200/50mg [Aluvia], tablets, 120 Tabs",Lopinavir/Ritonavir,Aluvia,200/50mg,Tablet,120,15560,287393.2,18.47,0.15,ABBVIE Ludwigshafen Germany,Yes,3834.0,16386.12,295.44,168 days 00:00:00.000000000
3002,SCMS-129760,Rwanda,PMO - US,Direct Drop,EXW,Air,2011-11-30,3/9/2012,2012-06-22,2012-06-22,2012-06-22,ARV,Pediatric,CIPLA LIMITED,"Abacavir 20mg/ml, oral solution, Bottle, 240 ml",Abacavir,Generic,20mg/ml,Oral solution,240,4534,38539.0,8.5,0.04,"Cipla, Goa, India",Yes,1631.0,13116.57,54.03,205 days 00:00:00.000000000
3003,SCMS-164530,Vietnam,PMO - US,Direct Drop,FCA,Air,2012-10-15,11/7/2012,2013-04-09,2013-04-09,2013-04-09,ARV,Adult,ABBVIE LOGISTICS (FORMERLY ABBOTT LOGISTICS BV),"Ritonavir 100mg [Norvir], film coated tablets, 30 Tabs",Ritonavir,Norvir,100mg,Tablet,30,373,8675.98,23.26,0.78,ABBVIE Ludwigshafen Germany,Yes,55.0,17.72,10.73,176 days 00:00:00.000000000
3004,SCMS-259075,South Africa,PMO - US,Direct Drop,DDP,Truck,2014-09-11,5/11/2015,2015-05-12,2015-05-12,2015-05-12,ARV,Adult,PHARMACY DIRECT,"Zidovudine 300mg, tablets, 60 Tabs",Zidovudine,Generic,300mg,Tablet,60,11,198.35,18.03,0.3,"Aurobindo Unit III, India",No,4306.83476898982,11462.107118413907,0.2,243 days 00:00:00.000000000
3007,SCMS-54980,South Africa,PMO - US,Direct Drop,DDP,Truck,2009-10-08,10/15/2009,2009-10-19,2009-10-19,2009-10-19,ARV,Pediatric,S. BUYS WHOLESALER,"Zidovudine 100mg [Retrovir], capsules, 100 Caps",Zidovudine,Retrovir,100mg,Capsule,100,40,591.97,14.8,0.15,GSK Crawley,No,4306.83476898982,11462.107118413907,1.16,11 days 00:00:00.000000000
3008,SCMS-215410,South Africa,PMO - US,Direct Drop,DDP,Truck,2013-11-14,12/2/2013,2014-01-13,2014-01-13,2014-01-13,ARV,Pediatric,S. BUYS WHOLESALER,"Abacavir 20mg/ml, oral solution w/syringe, Bottle, 240 ml",Abacavir,Generic,20mg/ml,Oral solution,240,16,367.09,22.94,0.1,"Aurobindo Unit III, India",No,4306.83476898982,11462.107118413907,0.38,60 days 00:00:00.000000000
3011,SCMS-186920,Tanzania,PMO - US,Direct Drop,EXW,Air,2013-04-12,5/14/2013,2013-09-05,2013-09-05,2013-09-05,ARV,Adult,MYLAN LABORATORIES LTD (FORMERLY MATRIX LABORATORIES),"Atazanavir/Ritonavir 300/100mg, tablets, 30 Tabs",Atazanavir/Ritonavir,Generic,300/100mg,Tablet,30,5175,116437.5,22.5,0.75,Mylan (formerly Matrix) Nashik,Yes,775.0,4136.58,144.03,146 days 00:00:00.000000000
3012,SCMS-59690,Côte d'Ivoire,PMO - US,Direct Drop,CIP,Air,2009-12-08,12/14/2009,2010-06-10,2010-06-10,2010-06-10,ARV,Pediatric,BRISTOL-MYERS SQUIBB,"Didanosine 50mg [Videx], chewable tablets, 60 Tabs",Didanosine,Videx,50mg,Chewable/dispersible tablet,60,4245,40327.5,9.5,0.16,"BMS Meymac, France",Yes,833.0,1134.5,86.95,184 days 00:00:00.000000000
3015,SCMS-50950,South Africa,PMO - US,Direct Drop,DDP,Truck,2009-05-07,8/3/2009,2009-09-03,2009-09-03,2009-09-03,ARV,Adult,S. BUYS WHOLESALER,"Tenofovir Disoproxil Fumarate 300mg [Viread], tablets, 30 Tabs",Tenofovir Disoproxil Fumarate,Viread,300mg,Tablet,30,800,21392.98,26.74,0.89,"Aspen-OSD, Port Elizabeth, SA",Yes,4306.83476898982,11462.107118413907,41.93,119 days 00:00:00.000000000
3016,SCMS-210440,Haiti,PMO - US,Direct Drop,FCA,Air,2013-08-21,10/22/2013,2014-01-23,2014-01-23,2014-01-24,ARV,Adult,ABBVIE LOGISTICS (FORMERLY ABBOTT LOGISTICS BV),"Lopinavir/Ritonavir 200/50mg [Aluvia], tablets, 120 Tabs",Lopinavir/Ritonavir,Aluvia,200/50mg,Tablet,120,646,12480.72,19.32,0.16,ABBVIE Ludwigshafen Germany,Yes,166.0,737.11,15.44,155 days 00:00:00.000000000
3017,SCMS-45670,Mozambique,PMO - US,Direct Drop,CIP,Air,2009-03-25,5/13/2009,2009-12-04,2009-12-04,2009-12-04,ARV,Adult,GLAXOSMITHKLINE EXPORT LIMITED,"Abacavir/Lamivudine/Zidovudine 300/150/300mg [Trizivir], tablets, 60 Tabs",Abacavir/Lamivudine/Zidovudine,Trizivir,300/150/300mg,Tablet - FDC,60,4,214.84,53.71,0.9,GSK Ware (UK),Yes,155.0,11462.107118413907,0.42,254 days 00:00:00.000000000
3019,SCMS-63980,Guyana,PMO - US,Direct Drop,EXW,Air,2010-01-19,1/28/2010,2010-04-09,2010-04-09,2010-04-09,ARV,Pediatric,CIPLA LIMITED,"Lamivudine/Nevirapine/Stavudine 60/100/12mg, dispersible tablets, 60 Tabs",Lamivudine/Nevirapine/Stavudine,Generic,60/100/12mg,Chewable/dispersible tablet - FDC,60,90,387.0,4.3,0.07,"Cipla, Goa, India",Yes,9.0,541.88,0.83,80 days 00:00:00.000000000
3020,SCMS-238553,South Africa,PMO - US,Direct Drop,DDP,Truck,2014-04-30,8/28/2014,2014-08-28,2014-08-28,2014-08-28,ARV,Adult,PHARMACY DIRECT,"Emtricitabine/Tenofovir Disoproxil Fumarate 200/300mg, tablets, 30 Tabs",Emtricitabine/Tenofovir Disoproxil Fumarate,Generic,200/300mg,Tablet - FDC,30,11,332.32,30.21,1.01,"Aurobindo Unit III, India",No,4306.83476898982,11462.107118413907,0.34,120 days 00:00:00.000000000
3022,SCMS-248220,Zimbabwe,PMO - US,Direct Drop,EXW,Air,2014-07-01,8/4/2014,2014-09-18,2014-09-18,2014-09-19,ARV,Pediatric,ABBVIE LOGISTICS (FORMERLY ABBOTT LOGISTICS BV),"Lopinavir/Ritonavir 80/20mg/ml [Kaletra], oral solution, cool, Bottle 5 x 60 ml",Lopinavir/Ritonavir,Kaletra,80/20mg/ml,Oral solution,300,2025,62410.5,30.82,0.1,ABBVIE (Abbott) Logis. UK,Yes,1902.0,16777.24,64.16,79 days 00:00:00.000000000
3024,SCMS-164680,Vietnam,PMO - US,Direct Drop,EXW,Air,2012-10-15,11/7/2012,2013-04-02,2013-04-02,2013-04-02,ARV,Adult,HETERO LABS LIMITED,"Zidovudine 300mg, tablets, 60 Tabs",Zidovudine,Generic,300mg,Tablet,60,1082,6221.5,5.75,0.1,Hetero Unit III Hyderabad IN,Yes,2228.0,3565.08,7.7,169 days 00:00:00.000000000
3028,SCMS-123530,Vietnam,PMO - US,Direct Drop,EXW,Air,2011-09-21,10/3/2011,2012-04-24,2012-04-24,2012-04-24,ARV,Adult,MYLAN LABORATORIES LTD (FORMERLY MATRIX LABORATORIES),"Efavirenz/Lamivudine/Tenofovir Disoproxil Fumarate 600/300/300mg, tablets, 30 Tabs",Efavirenz/Lamivudine/Tenofovir Disoproxil Fumarate,Generic,600/300/300mg,Tablet - FDC,30,5451,76859.1,14.1,0.47,Mylan (formerly Matrix) Nashik,Yes,1675.0,3401.49,126.82,216 days 00:00:00.000000000
3029,SCMS-238553,South Africa,PMO - US,Direct Drop,DDP,Truck,2014-04-30,8/28/2014,2014-08-28,2014-08-28,2014-08-28,ARV,Adult,PHARMACY DIRECT,"Lamivudine/Zidovudine 150/300mg, tablets, 60 Tabs",Lamivudine/Zidovudine,Generic,150/300mg,Tablet - FDC,60,16,499.07,31.19,0.52,"Aurobindo Unit III, India",No,4306.83476898982,11462.107118413907,0.51,120 days 00:00:00.000000000
3031,SCMS-91830,Côte d'Ivoire,PMO - US,Direct Drop,FCA,Air,2010-11-04,11/11/2010,2011-01-14,2011-01-14,2011-01-14,ARV,Adult,ABBVIE LOGISTICS (FORMERLY ABBOTT LOGISTICS BV),"Lopinavir/Ritonavir 200/50mg [Aluvia], tablets, 120 Tabs",Lopinavir/Ritonavir,Aluvia,200/50mg,Tablet,120,7320,264691.2,36.16,0.3,ABBVIE Ludwigshafen Germany,Yes,1838.0,13562.36,436.74,71 days 00:00:00.000000000
3033,SCMS-166140,Vietnam,PMO - US,Direct Drop,EXW,Air,2012-10-15,11/9/2012,2013-01-09,2013-01-09,2013-01-09,ARV,Pediatric,Aurobindo Pharma Limited,"Lamivudine 10mg/ml, oral solution w/syringe, Bottle, 240 ml",Lamivudine,Generic,10mg/ml,Oral solution,240,136,251.6,1.85,0.01,"Aurobindo Unit III, India",Yes,173.0,1079.39,0.31,86 days 00:00:00.000000000
3034,SCMS-104240,South Africa,PMO - US,Direct Drop,DDP,Ocean,2011-03-11,3/30/2011,2011-11-18,2011-11-18,2011-11-18,ARV,Pediatric,GLAXOSMITHKLINE EXPORT LIMITED,"Abacavir 20mg/ml [Ziagen], oral solution, Bottle, 240 ml",Abacavir,Ziagen,20mg/ml,Oral solution,240,20000,185600.0,9.28,0.04,GSK Mississauga (Canada),Yes,7664.0,17022.13,306.24,252 days 00:00:00.000000000
3035,SCMS-84250,South Africa,PMO - US,Direct Drop,DDP,Ocean,2010-08-31,9/21/2010,2010-12-15,2010-12-15,2010-12-15,ARV,Adult,STRIDES ARCOLAB LIMITED,"Lamivudine 150mg, tablets, 60 Tabs",Lamivudine,Generic,150mg,Tablet,60,168711,416716.17,2.47,0.04,"Strides, Bangalore, India.",Yes,8183.0,12225.76,898.44,106 days 00:00:00.000000000
3036,SCMS-259079,South Africa,PMO - US,Direct Drop,DDP,Truck,2014-09-11,10/9/2014,2015-08-24,2015-08-24,2015-08-24,ARV,Adult,PHARMACY DIRECT,"Abacavir 300mg, tablets, 60 Tabs",Abacavir,Generic,300mg,Tablet,60,82,4392.17,53.56,0.89,"Aurobindo Unit III, India",No,4306.83476898982,11462.107118413907,4.52,347 days 00:00:00.000000000
3037,SCMS-183050,Zambia,PMO - US,Direct Drop,FCA,Air,2013-02-13,3/28/2013,2013-05-22,2013-05-22,2013-05-22,ARV,Pediatric,ABBVIE LOGISTICS (FORMERLY ABBOTT LOGISTICS BV),"Lopinavir/Ritonavir 80/20mg/ml [Kaletra], oral solution, cool, Bottle 5 x 60 ml",Lopinavir/Ritonavir,Kaletra,80/20mg/ml,Oral solution,300,1500,46230.0,30.82,0.1,ABBVIE (Abbott) Logis. UK,Yes,1374.0,10365.13,57.19,98 days 00:00:00.000000000
3038,SCMS-72870,South Africa,PMO - US,Direct Drop,DDP,Truck,2010-04-30,5/5/2010,2010-05-12,2010-05-12,2010-05-12,ARV,Pediatric,S. BUYS WHOLESALER,"Lopinavir/Ritonavir 80/20mg/ml [Kaletra], oral solution, cool, Bottle 5 x 60 ml",Lopinavir/Ritonavir,Kaletra,80/20mg/ml,Oral solution,300,50,2037.29,40.75,0.14,ABBVIE (Abbott) Logis. UK,Yes,4306.83476898982,11462.107118413907,4.39,12 days 00:00:00.000000000
3041,SCMS-210120,Vietnam,PMO - US,Direct Drop,EXW,Air,2013-10-04,10/10/2013,2014-04-23,2014-04-23,2014-04-23,ARV,Adult,HETERO LABS LIMITED,"Efavirenz 600mg, tablets, 30 Tabs",Efavirenz,Generic,600mg,Tablet,30,2516,8151.84,3.24,0.11,Hetero Unit III Hyderabad IN,No,4306.83476898982,11462.107118413907,10.08,201 days 00:00:00.000000000
3042,SCMS-69220,Vietnam,PMO - US,Direct Drop,FCA,Air,2010-03-22,3/31/2010,2010-07-16,2010-07-16,2010-07-16,ARV,Adult,ABBVIE LOGISTICS (FORMERLY ABBOTT LOGISTICS BV),"Lopinavir/Ritonavir 200/50mg [Aluvia], tablets, 120 Tabs",Lopinavir/Ritonavir,Aluvia,200/50mg,Tablet,120,5530,454566.0,82.2,0.68,ABBVIE Ludwigshafen Germany,Yes,1348.0,10670.09,980.04,116 days 00:00:00.000000000
3043,SCMS-103360,South Africa,PMO - US,Direct Drop,DDP,Ocean,2011-03-10,3/24/2011,2011-09-02,2011-09-14,2011-09-14,ARV,Pediatric,Aurobindo Pharma Limited,"Efavirenz 50mg, capsule, 30 Caps",Efavirenz,Generic,50mg,Capsule,30,2247,5482.68,2.44,0.08,"Aurobindo Unit III, India",Yes,4306.83476898982,11462.107118413907,9.05,188 days 00:00:00.000000000
3044,SCMS-263670,Vietnam,PMO - US,Direct Drop,EXW,Air,2014-10-30,12/8/2014,2015-04-14,2015-04-14,2015-04-14,ARV,Adult,HETERO LABS LIMITED,"Abacavir 300mg, tablets, 60 Tabs",Abacavir,Generic,300mg,Tablet,60,1900,21280.0,11.2,0.19,Hetero Unit III Hyderabad IN,Yes,2356.0,3688.77,21.88,166 days 00:00:00.000000000
3045,SCMS-202560,Uganda,PMO - US,Direct Drop,EXW,Air,2013-08-05,8/9/2013,2013-12-10,2013-12-12,2013-12-13,ARV,Pediatric,Aurobindo Pharma Limited,"Nevirapine 10mg/ml, oral suspension w/syringe, Bottle, 100 ml",Nevirapine,Generic,10mg/ml,Oral suspension,100,11310,14703.0,1.3,0.01,"Aurobindo Unit III, India",Yes,2454.0,10898.12,18.19,129 days 00:00:00.000000000
3046,SCMS-259078,South Africa,PMO - US,Direct Drop,DDP,Truck,2014-09-11,10/9/2014,2015-07-24,2015-07-24,2015-07-24,ARV,Adult,PHARMACY DIRECT,"Lamivudine/Zidovudine 150/300mg, tablets, 60 Tabs",Lamivudine/Zidovudine,Generic,150/300mg,Tablet - FDC,60,23,528.93,23.0,0.38,"Aurobindo Unit III, India",No,4306.83476898982,11462.107118413907,0.54,316 days 00:00:00.000000000
3047,SCMS-259078,South Africa,PMO - US,Direct Drop,DDP,Truck,2014-09-11,10/9/2014,2015-07-24,2015-07-24,2015-07-24,ARV,Adult,PHARMACY DIRECT,"Nevirapine 200mg, tablets, 60 Tabs",Nevirapine,Generic,200mg,Tablet,60,23,315.96,13.74,0.23,"Aurobindo Unit III, India",No,4306.83476898982,11462.107118413907,0.32,316 days 00:00:00.000000000
3048,SCMS-83890,South Africa,PMO - US,Direct Drop,DDP,Ocean,2010-08-31,9/21/2010,2011-02-24,2011-02-24,2011-02-24,ARV,Pediatric,CIPLA LIMITED,"Lamivudine 10mg/ml, oral solution w/syringe, Bottle, 240 ml",Lamivudine,Generic,10mg/ml,Oral solution,240,55000,114400.0,2.08,0.01,"Cipla, Goa, India",Yes,20419.0,17267.14,246.65,177 days 00:00:00.000000000
3049,SCMS-77250,Vietnam,PMO - US,Direct Drop,EXW,Air,2010-06-23,7/1/2010,2010-12-08,2010-12-08,2010-12-08,ARV,Adult,Aurobindo Pharma Limited,"Lamivudine/Zidovudine 150/300mg, tablets, 60 Tabs",Lamivudine/Zidovudine,Generic,150/300mg,Tablet - FDC,60,20000,165000.0,8.25,0.14,"Aurobindo Unit III, India",Yes,1951.0,13083.7,355.74,168 days 00:00:00.000000000
3051,SCMS-226251,Vietnam,PMO - US,Direct Drop,EXW,Air,2014-02-06,6/27/2014,2014-11-03,2014-11-03,2014-11-03,ARV,Adult,MYLAN LABORATORIES LTD (FORMERLY MATRIX LABORATORIES),"Lamivudine/Zidovudine 150/300mg, tablets, 60 Tabs",Lamivudine/Zidovudine,Generic,150/300mg,Tablet - FDC,60,20000,129800.0,6.49,0.11,Mylan (formerly Matrix) Nashik,Yes,1725.0,3273.14,133.43,270 days 00:00:00.000000000
3053,SCMS-238555,South Africa,PMO - US,Direct Drop,DDP,Truck,2014-04-30,11/4/2014,2014-11-05,2014-11-05,2014-11-05,ARV,Adult,PHARMACY DIRECT,"Lamivudine 150mg, tablets, 60 Tabs",Lamivudine,Generic,150mg,Tablet,60,203,1855.98,9.14,0.15,"Aurobindo Unit III, India",Yes,4306.83476898982,11462.107118413907,1.91,189 days 00:00:00.000000000
3054,SCMS-54980,South Africa,PMO - US,Direct Drop,DDP,Truck,2009-10-08,10/15/2009,2009-10-21,2009-10-21,2009-10-21,ARV,Pediatric,S. BUYS WHOLESALER,"Lamivudine 10mg/ml [Epivir], oral solution, Bottle, 240 ml",Lamivudine,Epivir,10mg/ml,Oral solution,240,1000,6669.31,6.67,0.03,GSK Mississauga (Canada),Yes,4306.83476898982,11462.107118413907,13.07,13 days 00:00:00.000000000
3055,SCMS-47550,Namibia,PMO - US,Direct Drop,EXW,Air,2009-05-29,6/15/2009,2009-08-05,2009-08-05,2009-08-05,ARV,Pediatric,CIPLA LIMITED,"Lamivudine/Nevirapine/Stavudine 30/50/6mg, dispersible tablets, 60 Tabs",Lamivudine/Nevirapine/Stavudine,Generic,30/50/6mg,Chewable/dispersible tablet - FDC,60,688,1651.2,2.4,0.04,"Cipla, Goa, India",Yes,53.0,571.53,3.24,68 days 00:00:00.000000000
3056,SCMS-238552,South Africa,PMO - US,Direct Drop,DDP,Truck,2014-04-30,8/5/2014,2014-08-05,2014-08-05,2014-08-05,ARV,Adult,PHARMACY DIRECT,"Saquinavir 200mg [Invirase], capsules, 270 Caps",Saquinavir,Invirase,200mg,Capsule,270,30,2177.92,72.6,0.27,Roche Basel,Yes,4306.83476898982,11462.107118413907,2.24,97 days 00:00:00.000000000
3058,SCMS-54140,Uganda,PMO - US,Direct Drop,FCA,Air,2009-09-08,9/30/2009,2009-11-04,2009-11-04,2009-11-04,ARV,Adult,ABBVIE LOGISTICS (FORMERLY ABBOTT LOGISTICS BV),"Lopinavir/Ritonavir 200/50mg [Aluvia], tablets, 120 Tabs",Lopinavir/Ritonavir,Aluvia,200/50mg,Tablet,120,60,2169.6,36.16,0.3,ABBVIE Ludwigshafen Germany,Yes,36.0,814.04,4.25,57 days 00:00:00.000000000
3061,SCMS-156310,Vietnam,PMO - US,Direct Drop,EXW,Air,2012-07-25,8/15/2012,2012-12-14,2012-12-14,2012-12-14,ARV,Adult,HETERO LABS LIMITED,"Lamivudine/Zidovudine 150/300mg, tablets, 60 Tabs",Lamivudine/Zidovudine,Generic,150/300mg,Tablet - FDC,60,10158,71918.64,7.08,0.12,Hetero Unit III Hyderabad IN,Yes,941.0,1934.17,100.83,142 days 00:00:00.000000000
3062,SCMS-239810,"Congo, DRC",PMO - US,Direct Drop,EXW,Air,2014-05-15,5/19/2014,2014-09-30,2014-09-30,2014-10-21,ARV,Pediatric,Aurobindo Pharma Limited,"Didanosine 200mg, delayed-release capsules, 30 Caps",Didanosine,Generic,200mg,Delayed-release capsules,30,550,6050.0,11.0,0.37,"Aurobindo Unit III, India",No,4306.83476898982,11462.107118413907,6.22,138 days 00:00:00.000000000
3063,SCMS-137421,Rwanda,PMO - US,Direct Drop,EXW,Air,2011-12-07,6/14/2012,2012-07-20,2012-07-20,2012-07-20,ARV,Adult,HETERO LABS LIMITED,"Efavirenz 600mg, tablets, 30 Tabs",Efavirenz,Generic,600mg,Tablet,30,20370,72720.9,3.57,0.12,Hetero Unit III Hyderabad IN,Yes,1751.0,13244.8,101.95,226 days 00:00:00.000000000
3066,SCMS-142320,Uganda,PMO - US,Direct Drop,DDP,Air,2012-03-15,4/17/2012,2012-07-05,2012-07-05,2012-07-05,ARV,Adult,ASPEN PHARMACARE,"Etravirine 100mg [Intelence], tablets, 120 Tabs",Etravirine,Intelence,100mg,Tablet,120,150,11250.0,75.0,0.62,"Janssen-Cilag, Latina, IT",Yes,49.0,475.0,15.77,112 days 00:00:00.000000000
3067,SCMS-236060,Vietnam,PMO - US,Direct Drop,EXW,Air,2014-04-08,4/30/2014,2014-09-22,2014-09-15,2014-09-17,ARV,Adult,HETERO LABS LIMITED,"Efavirenz/Lamivudine/Tenofovir Disoproxil Fumarate 600/300/300mg, tablets, 30 Tabs",Efavirenz/Lamivudine/Tenofovir Disoproxil Fumarate,Generic,600/300/300mg,Tablet - FDC,30,17280,181440.0,10.5,0.35,Hetero Unit III Hyderabad IN,Yes,2401.0,3701.66,186.52,160 days 00:00:00.000000000
3068,SCMS-51270,Nigeria,PMO - US,Direct Drop,FCA,Air,2009-08-03,8/12/2009,2009-12-15,2009-12-15,2009-12-15,ARV,Adult,Hoffmann-La Roche ltd Basel,"Saquinavir 500mg [Invirase], tablets, 120 Tabs",Saquinavir,Invirase,500mg,Tablet,120,500,47667.85,95.34,0.79,Roche Basel,Yes,83.0,852.02,93.43,134 days 00:00:00.000000000
3069,SCMS-71370,South Africa,PMO - US,Direct Drop,DDP,Truck,2010-04-19,4/21/2010,2010-05-31,2010-05-31,2010-05-31,ARV,Adult,S. BUYS WHOLESALER,"Emtricitabine/Tenofovir Disoproxil Fumarate 200/300mg [Truvada], tablets, 30 Tabs",Emtricitabine/Tenofovir Disoproxil Fumarate,Truvada,300/200mg,Tablet - FDC,30,540,25796.95,47.77,1.59,"Aspen-OSD, Port Elizabeth, SA",No,4306.83476898982,11462.107118413907,55.62,42 days 00:00:00.000000000
3070,SCMS-202390,Zambia,PMO - US,Direct Drop,EXW,Air,2013-07-22,8/12/2013,2014-02-14,2014-02-14,2014-02-18,ARV,Adult,MYLAN LABORATORIES LTD (FORMERLY MATRIX LABORATORIES),"Emtricitabine/Tenofovir Disoproxil Fumarate 200/300mg, tablets, 30 Tabs",Emtricitabine/Tenofovir Disoproxil Fumarate,Generic,200/300mg,Tablet - FDC,30,300000,1722000.0,5.74,0.19,Mylan (formerly Matrix) Nashik,Yes,24233.0,119474.09,2130.11,207 days 00:00:00.000000000
3072,SCMS-145310,Vietnam,PMO - US,Direct Drop,EXW,Air,2012-04-11,6/11/2012,2012-10-02,2012-10-02,2012-10-02,ARV,Adult,MYLAN LABORATORIES LTD (FORMERLY MATRIX LABORATORIES),"Abacavir 300mg, tablets, 60 Tabs",Abacavir,Generic,300mg,Tablet,60,331,4220.25,12.75,0.21,Mylan (formerly Matrix) Nashik,Yes,2951.0,7211.04,5.92,174 days 00:00:00.000000000
3073,SCMS-145310,Vietnam,PMO - US,Direct Drop,EXW,Air,2012-04-11,6/11/2012,2012-10-02,2012-10-02,2012-10-02,ARV,Adult,MYLAN LABORATORIES LTD (FORMERLY MATRIX LABORATORIES),"Tenofovir Disoproxil Fumarate 300mg, tablets, 30 Tabs",Tenofovir Disoproxil Fumarate,Generic,300mg,Tablet,30,30704,137860.96,4.49,0.15,Mylan (formerly Matrix) Nashik,No,4306.83476898982,11462.107118413907,193.28,174 days 00:00:00.000000000
3074,SCMS-145530,Vietnam,PMO - US,Direct Drop,EXW,Air,2012-04-11,6/12/2012,2012-10-09,2012-10-09,2012-10-09,ARV,Pediatric,MYLAN LABORATORIES LTD (FORMERLY MATRIX LABORATORIES),"Lamivudine/Nevirapine/Zidovudine 30/50/60mg, dispersible tablets, 60 Tabs",Lamivudine/Nevirapine/Zidovudine,Generic,30/50/60mg,Chewable/dispersible tablet - FDC,60,1302,5403.3,4.15,0.07,Mylan (formerly Matrix) Nashik,Yes,4587.0,11252.53,7.58,181 days 00:00:00.000000000
3075,SCMS-148370,Haiti,PMO - US,Direct Drop,EXW,Ocean,2012-05-14,7/3/2012,2012-12-20,2012-12-20,2012-12-20,ARV,Adult,MYLAN LABORATORIES LTD (FORMERLY MATRIX LABORATORIES),"Lamivudine/Nevirapine/Zidovudine 150/200/300mg, tablets, 60 Tabs",Lamivudine/Nevirapine/Zidovudine,Generic,150/300/200mg,Tablet - FDC,60,34080,318648.0,9.35,0.16,Mylan (formerly Matrix) Nashik,Yes,4726.0,7208.11,446.74,220 days 00:00:00.000000000
3076,SCMS-199289,South Africa,PMO - US,Direct Drop,DDP,Truck,2013-07-11,8/29/2014,2014-08-29,2014-08-29,2014-08-29,ARV,Adult,S. BUYS WHOLESALER,"Tenofovir Disoproxil Fumarate 300mg, tablets, 30 Tabs",Tenofovir Disoproxil Fumarate,Generic,300mg,Tablet,30,627,13051.03,20.82,0.69,Hetero Unit III Hyderabad IN,Yes,4306.83476898982,11462.107118413907,16.14,414 days 00:00:00.000000000
3077,SCMS-259079,South Africa,PMO - US,Direct Drop,DDP,Truck,2014-09-11,10/9/2014,2015-08-24,2015-08-24,2015-08-24,ARV,Adult,PHARMACY DIRECT,"Efavirenz 600mg, tablets, 30 Tabs",Efavirenz,Generic,600mg,Tablet,30,42,507.93,12.09,0.4,"Aurobindo Unit III, India",Yes,4306.83476898982,11462.107118413907,0.52,347 days 00:00:00.000000000
3078,SCMS-103390,South Africa,PMO - US,Direct Drop,DDP,Ocean,2011-03-10,3/24/2011,2011-10-10,2011-11-03,2011-11-03,ARV,Adult,Aurobindo Pharma Limited,"Efavirenz 600mg, tablets, 30 Tabs",Efavirenz,Generic,600mg,Tablet,30,106589,480716.39,4.51,0.15,"Aurobindo Unit III, India",Yes,9061.0,9323.3,793.18,238 days 00:00:00.000000000
